id,discurso,nome,siglaPartido,siglaUf
3601173,- A lista de presença registra na Casa o comparecimento de 135 Senhoras Deputadas e Senhores Deputados.,GILBERTO_NASCIMENTO,PSD,SP
3601173,Está aberta a sessão.,GILBERTO_NASCIMENTO,PSD,SP
3601173,Sob a proteção de Deus e em nome do povo brasileiro iniciamos nossos trabalhos.,GILBERTO_NASCIMENTO,PSD,SP
3601178,- Fica dispensada a leitura da ata da sessão anterior.,GILBERTO_NASCIMENTO,PSD,SP
3601187,- Passa-se às Breves Comunicações.,GILBERTO_NASCIMENTO,PSD,SP
3601187,"Breves Comunicações é o momento em que os Deputados têm, no mínimo, 3 minutos para fazer os seus pronunciamentos.",GILBERTO_NASCIMENTO,PSD,SP
3601187,"Hoje, nós vamos começar pelo Rio Grande do Norte. No Rio Grande do Norte, nós vamos ouvir o Deputado General Girão. Tem S.Exa. a palavra.",GILBERTO_NASCIMENTO,PSD,SP
3601171,"- Deputado Gilberto, é sempre uma honra podermos estar juntos aqui.",GENERAL_GIRÃO,PL,RN
3601171,"Eu gostaria de pedir, inicialmente, que a nossa voz tivesse eco no programa A Voz do Brasil.",GENERAL_GIRÃO,PL,RN
3601171,"Eu vou falar hoje sobre segurança pública, Deputado Coronel Chrisóstomo, que tem sido o item 1 da preocupação dos brasileiros há mais de duas décadas O item 1 é sempre segurança. É o povo preocupado com a sua segurança.",GENERAL_GIRÃO,PL,RN
3601171,"Nós sabemos que, nesses governos do PT, a segurança está sempre em uma situação caótica. E, no meu Rio Grande do Norte, não é diferente. Mas a minha fala hoje vai ser da fronteira do Brasil, do Mato Grosso. Um caso absurdo ocorreu em Cáceres, Mato Grosso. Um crime foi cometido na cidade de Porto Espiridião, na fronteira.",GENERAL_GIRÃO,PL,RN
3601147,"O que aconteceu? Houve uma prisão, a polícia de fronteira prendeu traficantes com 420 quilos de drogas — 420 quilos, maconha e cocaína —, e simplesmente o juiz federal de plantão liberou os caras.",GENERAL_GIRÃO,PL,RN
3601147,"Vejam só o absurdo! Na audiência de custódia o juiz federal liberou os caras. Esses caras foram liberados e foram soltos. Sorte da população do Mato Grosso, sorte nossa, que no mesmo diapasão, no dia seguinte, um juiz que não era de plantão decidiu pela revogação dessa soltura e determinou a prisão. Sorte nossa que a polícia do Mato Grosso conseguiu pegar os dois e prender de novo. Eles já haviam sido soltos.",GENERAL_GIRÃO,PL,RN
3601147,Cumprimento o Governador Mauro Mendes.,GENERAL_GIRÃO,PL,RN
3601147,"Governador, o senhor está de parabéns. O senhor fez uma fala dizendo: ""Ou as leis deste País são frouxas ou o Judiciário está falhando"". Governador, na lei é para ser preso. Se foi preso com droga, tem que ficar preso e não tem que ser solto, não. Não se justifica, desculpe-me o juiz de plantão, a soltura de traficantes, não se justifica. Estava com droga é prisão sem direito à soltura e sem direito à fiança. Os caras foram soltos.",GENERAL_GIRÃO,PL,RN
3601147,"O Governador na sua fala também cobrou aqui do Congresso o endurecimento das penas. Nós temos, sim, projeto de lei na Comissão de Segurança Pública e Combate ao Crime Organizado para que esse pessoal seja preso e as penas sejam ampliadas, sejam reforçadas, porque quem usa droga, quem consome, quem usa da sua vida para vender droga é porque realmente tem que apodrecer na cadeia, é assim que tem que ser.",GENERAL_GIRÃO,PL,RN
3601147,"Vamos lá! Eu quero dizer para vocês que um caso idêntico aconteceu no Rio Grande do Norte há uns 4 anos. Naquela oportunidade, um casal que foi preso em uma caminhonete carregando drogas, também mais de 500 quilos, foi solto por um juiz estadual durante a audiência de custódia. O Ministério Público recorreu. No dia seguinte, um desembargador determinou a prisão. Ocorre que os pombinhos já tinham voado para longe.",GENERAL_GIRÃO,PL,RN
3601147,"Meus amigos, audiência de custódia é só para cumprir a norma. O cara que é preso em flagrante, com droga, não tem que ter direito a ser solto em audiência de custódia. Será que teremos que ter uma lei especificando isso para o juiz entender que não pode soltar quem foi preso com drogas? Não é possível. O Brasil já tem um excesso de lei; mas, se for preciso uma lei específica nesse sentido, nós vamos criar essa lei, porque não pode soltar traficante de drogas.",GENERAL_GIRÃO,PL,RN
3601147,"Muito obrigado, Sr. Presidente.",GENERAL_GIRÃO,PL,RN
3601159,"- O.k., Deputado General Girão, lá do nosso Rio Grande do Norte.",GILBERTO_NASCIMENTO,PSD,SP
3601159,"Do Rio Grande do Norte, então, nós vamos à Paraíba com o Deputado Luiz Couto.",GILBERTO_NASCIMENTO,PSD,SP
3601159,"Deputado Luiz Couto, que é Deputado pela Paraíba, padre que fez um grande trabalho na região, se elegeu Deputado Federal e hoje representa muito bem o Estado da Paraíba aqui no Congresso Nacional, na Câmara Federal, tem V.Exa. a palavra.",GILBERTO_NASCIMENTO,PSD,SP
3601148,"- Obrigado, Presidente.",LUIZ_COUTO,PT,PB
3601148,"Eu tenho dois assuntos a tratar. O primeiro é sobre o problema da depressão e as suas consequências. Desde 2019, por conta de uma quantidade enorme de pessoas depressivas, o Poder Judiciário do Estado da Paraíba, através da Associação das Esposas dos Magistrados e das Magistradas, tem feito um trabalho e verificado que, a cada dia mais, cresce o número de pessoas que ficam em depressão, às vezes, até chegando à morte. Aí, a solidão aparece, assim como o desemprego, a rejeição, traumas na construção de masculinidade, como também o estresse, que são elementos.",LUIZ_COUTO,PT,PB
3601202,"Neste sentido, eu queria parabenizar a Associação das Esposas dos Magistrados do Paraíba pelo trabalho que está realizando.",LUIZ_COUTO,PT,PB
3601202,"Em segundo lugar, Sr. Presidente, quero tratar de outro tema, que é ação do Governo, que não está respeitando a questão dos Bahá'ís lá no Irã. Há mais de 40 anos, a comunidade Bahá'í no Irã é alvo de uma política persecutória, sistemática, estabelecida pelo Estado iraniano, apesar de ser a maior minoria religiosa não-muçulmana.",LUIZ_COUTO,PT,PB
3601202,"Neste sentido, há julgamentos sem respeito às sentenças de prisão, confisco de terras e propriedades, discurso de ódio, negação do direito à educação e dos direitos funerários. Por exemplo, Sr. Presidente, agora até as sepulturas — mais de 30 sepulturas novas, lá nos Bahá'ís falecidos, enterrados há apenas alguns meses em valas comuns, em Teerã — foram destruídas pelas autoridades iranianas. Isso é um desrespeito que tem meu repúdio.",LUIZ_COUTO,PT,PB
3601202,"Deixo meu apoio ao movimento dos iranianos, tanto lá como em todo o Brasil.",LUIZ_COUTO,PT,PB
3601202,"Um abraço, Sr. Presidente.",LUIZ_COUTO,PT,PB
3601202,"Peço que seja dada a devida publicidade na comunicação desta Casa, inclusive no programa A Voz do Brasil.",LUIZ_COUTO,PT,PB
3601230,"- O.k., Deputado Padre Luiz Couto, lá da nossa Paraíba.",GILBERTO_NASCIMENTO,PSD,SP
3601230,"E, agora, da Paraíba, nós vamos então a São Paulo, com a Deputada Tabata Amaral.",GILBERTO_NASCIMENTO,PSD,SP
3601230,"O Deputado Afonso Hamm havia solicitado 1 minuto, mas já que a Deputada já está na tribuna, vamos ouvir a Deputada Tabata Amaral. Em seguida, nós chegamos no Rio Grande do Sul e vamos ouvir S.Exa. por um minuto.",GILBERTO_NASCIMENTO,PSD,SP
3601230,"Tem V.Exa. a palavra, Deputada Tabata.",GILBERTO_NASCIMENTO,PSD,SP
3601203,"- Obrigada, Presidente.",TABATA_AMARAL,PSB,SP
3601203,"Venho falar aqui sobre algo muito grave e muito vergonhoso para nós que somos paulistanos. A Prefeitura de São Paulo ontem esteve nas principais manchetes do País. O motivo é um dos piores possíveis. Estou falando da Operação Fim de Linha, que foi deflagrada ontem por inúmeros órgãos e que retrata a maior operação policial da história contra a infiltração do crime organizado no poder público. É isso mesmo que eu estou dizendo. Duas empresas de ônibus, a Transwolff e a UPBus, estão sendo acusadas de fazer lavagem — nada mais, nada menos— do dinheiro que vem do tráfico de drogas e de roubos do PCC. Essas são duas das principais empresas que atuam no transporte público em São Paulo e esta situação é muito grave.",TABATA_AMARAL,PSB,SP
3601580,"Aqui, eu deixo alguns questionamentos a serem respondidos não para mim, mas para a população de São Paulo, pelo Prefeito. O primeiro deles é: por que temos duas empresas acusadas de ligação com o PCC sendo responsáveis pelo transporte de 700 mil pessoas? Por que, só no ano passado, essas empresas, que respondem a acusações tão graves, receberam 800 milhões de reais — quase 1 bilhão de reais — da Prefeitura?",TABATA_AMARAL,PSB,SP
3601580,"E eu vou além, e eis aqui, para mim, o ponto mais grave: por que Ricardo Nunes, Prefeito de São Paulo, escolheu a dedo uma dessas empresas que, novamente, é acusada de ligação com o crime organizado, para gerir seu principal projeto na zona sul da cidade? Não sei se todos sabem, mas o Prefeito vem defendendo com toda a força o transporte de barcos na represa Billings. E vejam só: sem transparência, sem licitação, sem nenhuma razão pública, ele escolheu justamente uma dessas empresas para ganhar — isso que ele quis fazer — mais um contrato da Prefeitura de São Paulo.",TABATA_AMARAL,PSB,SP
3601580,"Eu estou apresentando, Presidente, aqui no Congresso, um projeto de lei para tratar desse tipo de mercado de ilícitos, para que possamos rastrear empresas como essas duas e impedir que elas continuem assumindo contratos públicos.",TABATA_AMARAL,PSB,SP
3601580,"Eu também questionei, fiz um pedido aos órgãos de controle de São Paulo, para que impeçam que essa empresa, acusada de ligação com o PCC, assuma o transporte aquático na represa Billings.",TABATA_AMARAL,PSB,SP
3601580,"Peço a todos que continuem se posicionando, acompanhando, para que esse crime não seja abafado e para que todos os responsáveis, independente do tamanho político do cargo que ocupam, sejam responsabilizados e punidos.",TABATA_AMARAL,PSB,SP
3601580,"Não aguentamos mais, em São Paulo, ver tanto dinheiro público, tantos serviços tão essenciais na mão de máfias, que é o que essa denúncia tão grave vem apontando. Enquanto tivermos esse tipo de pessoa no poder, é impossível pensarmos em uma vida melhor para as pessoas.",TABATA_AMARAL,PSB,SP
3601580,"Entristece-me e me envergonha muito vir trazer essa notícia tão ruim da minha cidade de São Paulo — uma cidade tão grandiosa, a mais importante do nosso País. Entretanto, esse tipo de denúncia tem que ser levado a sério, não pode ser abafada, e não podemos parar até que todos os responsáveis sejam punidos.",TABATA_AMARAL,PSB,SP
3601580,"Obrigada, Presidente.",TABATA_AMARAL,PSB,SP
3601594,"- O.k., Deputada Tabata Amaral, da nossa cidade de São Paulo.",GILBERTO_NASCIMENTO,PSD,SP
3601594,"De São Paulo, então, nós vamos ao Rio de Janeiro. Antes de o Deputado Luiz Lima ocupar a tribuna, entretanto, vou passar pelo Rio Grande do Sul e ouvir, também por 1 minuto, o Deputado Afonso Hamm.",GILBERTO_NASCIMENTO,PSD,SP
3601594,"Tem V.Exa. a palavra, Deputado Afonso Hamm.",GILBERTO_NASCIMENTO,PSD,SP
3601581,"- Obrigado, Presidente.",AFONSO_HAMM,PP,RS
3601581,"Venho a esta tribuna estarrecido com o descaso da empresa CEEE Equatorial, que tem a responsabilidade de fornecer energia elétrica. No Rio Grande do Sul há, neste momento, há mais de 20 dias, algumas localidades rurais, muitas pelo interior do Rio Grande do Sul, sem energia elétrica, especialmente na região da Campanha Gaúcha e região Sul, em Pinheiro Machado, Lavras do Sul, Pedras Altas, Dom Pedrito, Arroio Grande, Cerrito, Piratini, Pelotas.",AFONSO_HAMM,PP,RS
3601581,"Tivemos mortes por lá, inclusive no Passo da Alexandrina, em Bagé, na minha cidade também faleceu um trabalhador rural. É impressionante o descaso.",AFONSO_HAMM,PP,RS
3601164,"Quero aqui dizer que aprovamos uma audiência pública importante na Comissão da Agricultura, convocando o Ministério de Minas e Energia, o Governador do Estado, a CEEE Equatorial, a ANEEL, com seu Diretor-Geral, o Procurador de Justiça do Estado, Alexandre Saltz, o Diretor-Executivo do PROCON e um Prefeito para representar a população, entre tantos, porque é absurdo termos mais de 20 dias sem energia. O produtor rural que tem produção de leite, aquele produtor que tem...  é realmente um descaso absurdo. Eu precisaria de muito tempo aqui para falar desse assunto na tribuna.",AFONSO_HAMM,PP,RS
3601164,"Mas agradeço, Presidente Gilberto, a oportunidade, porque nós precisamos de providências. E lá ninguém é escutado. Já existem ações na Justiça, por parte dos próprios Prefeitos, tem posicionamento dos consumidores, porque é um absurdo a população ficar hoje 20 dias sem energia elétrica. Então, a nossa esperança é que tomem providências, através desta audiência pública, aprovada hoje na Comissão de Agricultura.",AFONSO_HAMM,PP,RS
3601348,"- Do Rio Grande do Sul, agora nós vamos ao grande Rio, subindo a serra, para ouvir o Deputado Luiz Lima. Tem V.Exa. a palavra.",GILBERTO_NASCIMENTO,PSD,SP
3601165,"- Presidente Gilberto, é uma honra ter a sessão presidida por V.Exa.",LUIZ_LIMA,PL,RJ
3601165,"Presidente Gilberto, temos vários assuntos aqui de predominância nacional, mas acabamos nos esquecendo de... esquecendo não, não tendo oportunidade de, na velocidade que queremos, falar sobre o nosso Município do Rio de Janeiro, o Estado do Rio de Janeiro. A decisão do Prefeito Eduardo Paes de sufocar a Avenida Brasil, no Rio de Janeiro, que faz parte da BR-101, além de ser um elo de ligação dos bairros do Rio de Janeiro, dos bairros adjacentes, além de ser um elo com o sul do País até Rio Grande do Norte, é uma temeridade.",LUIZ_LIMA,PL,RJ
3601165,"A Avenida Brasil foi construída em 1946, quando a população do Rio de Janeiro girava em torno de 1,5 milhão de pessoas. Hoje a cidade do Rio de Janeiro tem 7 milhões de habitantes. O Túnel Rebouças, um elo de ligação entre a Zona Norte e a Zona Sul, chegando na Lagoa Rodrigo de Freitas, foi construído em 1967. A Ponte Rio-Niterói, em 1974. O metrô do Rio de Janeiro, em 1979. Não temos grandes obras no Rio de Janeiro, com exceção daquele rabicho de metrô, que fez um barulho ali da Zona Sul, Copacabana à Barra da Tijuca, mas que era já para ter chegado no final do Recreio dos Bandeirantes nos anos 80, usando o Terminal Alvorada como um elo de ligação do aeroporto com a Zona Norte, com a Zona Sul, com a Zona Oeste.",LUIZ_LIMA,PL,RJ
3601165,"O Rio de Janeiro é administrado, há 28 anos, pelo mesmo grupo político. Essa decisão do Prefeito Eduardo Paes de ocupar duas pistas, otimizando o BRT e causando um transtorno imenso no transporte no Rio de Janeiro, simboliza a ineficiência, a incompetência, o amadorismo, o oba-oba desse grupo que lidera o Rio de Janeiro há todos esses anos. O Rio de Janeiro precisa ter uma infraestrutura condicente com sua própria população hoje, que é quatro vezes maior do que na década de 50.",LUIZ_LIMA,PL,RJ
3601165,"A Avenida Brasil, do jeito que está, não tem jeito. As favelas cresceram, os bairros humildes se multiplicaram. Temos um déficit habitacional na cidade do Rio de Janeiro imenso, de Paquetá a Sepetiba. Temos um Prefeito que não se preocupa com o ordenamento público. Mais de 50% das crianças de ensino básico não têm pai nem mãe vivendo em casa. As 1.650 escolas do Município são dirigidas por militantes políticos e não por educadores.",LUIZ_LIMA,PL,RJ
3601152,"Então, a Avenida Brasil só tem uma solução: um metrô suspenso, que não ocupe aquele espaço e faça com que caminhões, ônibus e carros que circulam na cidade tenham opção.",LUIZ_LIMA,PL,RJ
3601152,"Segurança já não temos, com as barricadas na Avenida Brasil e 70% do território do Município ocupado por milícias e pelo tráfico. E o Prefeito não pede socorro, acha que está tudo bem. O Estado do Rio de Janeiro, com a Polícia Militar, tem um efetivo menor do que o do crime organizado, mas a República Federativa do Brasil se preocupa com o Elon Musk.",LUIZ_LIMA,PL,RJ
3601152,"Nós temos um problema seríssimo de segurança interna, de desenvolvimento habitacional e de pouco investimento na infraestrutura.",LUIZ_LIMA,PL,RJ
3601152,"O Rio de Janeiro pede socorro. Está nas suas mãos, eleitor, mudar o rumo da nossa cidade.",LUIZ_LIMA,PL,RJ
3601152,"Obrigado, Presidente Gilberto Nascimento.",GILBERTO_NASCIMENTO,PSD,SP
3601213,"- O.k., Deputado Luiz Lima, do nosso Rio de Janeiro.",GILBERTO_NASCIMENTO,PSD,SP
3601213,"Acompanhando a lista, vamos chamar o Deputado Gilson Daniel, do Espírito Santo, Estado vizinho, aonde, portanto, chega-se muito rápido.",GILBERTO_NASCIMENTO,PSD,SP
3601153,"- Sr. Presidente, Srs. Parlamentares, venho falar sobre uma conquista do nosso mandato, mais uma conquista da causa da criação de pássaros no Brasil. Saiu hoje publicada no Espírito Santo a Portaria Conjunta SEAG/SEAMA nº 1-R, de 9 de abril, que libera os torneios e as exposições no Espírito Santo.",GILSON_DANIEL,PODE,ES
3601153,"Essa portaria pode ser modelo para cada Estado da Federação que ainda não liberou os torneios e exposições, devido à gripe aviária ou a algumas questões estaduais. Essa portaria pode ser um modelo para todos os Estados brasileiros. Foi uma conquista nossa, junto com o Governador Renato Casagrande, junto com o Secretário da Agricultura, Enio Bergoli, junto com o Secretário do Meio Ambiente, que foi Deputado aqui, Felipe Rigoni, foi uma conquista para o Espírito Santo.",GILSON_DANIEL,PODE,ES
3601153,"Mas nós tivemos uma conquista também no IBAMA, que liberou as transferências, uma demanda que estava há mais de anos aqui no IBAMA nacional. Nós conseguimos liberar o SisPass, e hoje se pode fazer transferência. No Espírito Santo, além das transferências, pode-se também fazer os torneios e exposições.",GILSON_DANIEL,PODE,ES
3601153,"Criar é preservar, é preservar as espécies, é preservar a genética. Nós temos muitas criações de pássaros hoje no Brasil, nós temos mais de 500 mil criadores no Brasil, de diversas espécies da fauna brasileira. Hoje, com a possibilidade de transferência, com as atividades de torneios e exposições, essa cadeia produtiva, essa preservação das espécies, vai crescer a cada momento.",GILSON_DANIEL,PODE,ES
3601153,"Essa é a pauta que nós defendemos aqui, que às vezes desagrada alguns. Mas nós, nesta Casa, em todo o nosso mandato, estamos trabalhando fortemente para avançar cada vez mais. Temos nesta Casa o Código de Fauna, que é uma discussão importante para a preservação da criação de pássaros no Brasil. E iremos enterrar o Projeto 1.045, que foi protocolado nesta Casa agora, no dia 1º de abril, e que acaba com a criação de pássaros. Nós vamos trabalhar para arquivar esse processo e manter a criação de pássaros. É a nossa ação aqui na Câmara dos Deputados, é uma pauta que nós defendemos. Eu, Nely Aquino, Sargento Portugal e outros Deputados. Nós vamos trabalhar fortemente aqui, Sr. Presidente, para que nós possamos enterrar esse Projeto 1045. É um clamor de todos os criadores de pássaros do nosso País.",GILSON_DANIEL,PODE,ES
3601184,"Peço que o meu pronunciamento seja divulgado nos meios de comunicação desta Casa. Muito obrigado, Sr. Presidente.",GILSON_DANIEL,PODE,ES
3601188,"- Deputado Gilson Daniel, lá do nosso Espírito Santo.",GILBERTO_NASCIMENTO,PSD,SP
3601188,"Agora, do Espírito Santo, nós vamos ao Estado das Alagoas. No Estado das Alagoas, nós vamos ouvir o Deputado Paulão.",GILBERTO_NASCIMENTO,PSD,SP
3601188,"Logo em seguida, nós vamos lá para o outro lado, nós vamos para Santa Catarina com a Deputada Geovania de Sá.",GILBERTO_NASCIMENTO,PSD,SP
3601185,"- Sr. Presidente, colegas Parlamentares, eu queria usar a tribuna para uma notícia exitosa, importante para o povo brasileiro. O Presidente Lula, com seu compromisso com moradia, principalmente moradia popular, pois foi ele que criou esse programa desde o seu primeiro mandato, hoje amplia esse programa exitoso. Serão 75 mil moradias para o Minha Casa, Minha Vida Rural, paralisado no Governo anterior, que não tinha compromisso com a moradia do povo.",PAULÃO,PT,AL
3601185,"Serão 37 mil moradias para o Minha Casa, Minha Vida Entidades, investimento de quase 12 bilhões de reais. E, no meu Estado, Alagoas, serão 1.525 unidades habitacionais do Minha Casa, Minha Vida Rural, espalhadas em 26 Municípios, e 434 unidades habitacionais do Minha Casa, Minha Vida Entidades em três Municípios. Notícia exitosa. Você está realizando o sonho de ter moradia popular, principalmente uma população mais carente, que os bancos privados, infelizmente, não têm linha de crédito.",PAULÃO,PT,AL
3601185,"O outro assunto, Sr. Presidente, nós não podemos calar, é verdade que está havendo uma operação abafa para proteger um Deputado Federal do Rio de Janeiro que, de forma hedionda, é um dos autores intelectuais do crime da ex-Vereadora Marielle, uma mulher de luta, corajosa. É verdade isso? Os partidos mais conservadores... E aí eu quero fazer uma cobrança ao meu conterrâneo, o Presidente Arthur Lira. Não é possível que essa operação abafa não vá penalizar um Deputado envolvido de forma intelectual, com integrantes da sua família, num dos crimes mais hediondos que o Brasil teve na sua recente história.",ARTHUR_LIRA,PP,AL
3601185,"Eu me envergonho de fazer parte dessa Câmara Federal e percebo o silêncio de alguns, principalmente os da bancada conservadora, que são muitos corajosos para tentar colocar o bandido de pequeno porte, mas quando é Deputado, Conselheiro de Tribunal de Contas, amofinam-se, acovardam-se.",PAULÃO,PT,AL
3601191,Eu não quero fazer parte dessa história. Eu quero cobrar do Presidente Presidente Arthur Lira que traga aqui o crime hediondo praticado pelo Deputado Brazão; e eu quero colocar a minha digital para cassá-lo. Ele não tem condições morais de representar a Câmara Federal.,ARTHUR_LIRA,PP,AL
3601191,"Muito obrigado, Sr. Presidente.",PAULÃO,PT,AL
3601191,Gostaria que fosse divulgado nos meios de comunicação da Casa e no programa A Voz do Brasil.,PAULÃO,PT,AL
3601192,"- Deputado Paulão, atendendo o pedido de V.Exa., será divulgado em todos os órgãos de comunicação desta Casa. E agora, das Alagoas, nós vamos para o outro lado do Brasil, nós vamos para Santa Catarina para ouvirmos a Deputada Geovania de Sá.",GILBERTO_NASCIMENTO,PSD,SP
3601192,Tem V.Exa. a palavra.,GILBERTO_NASCIMENTO,PSD,SP
3601193,"- Sr. Presidente, o que me traz à tribuna nesta tarde de quarta-feira é algo que aguardávamos há muito tempo. Estou falando da aprovação do PLP 42, de 2023, que estava na pauta da Comissão de Trabalho. E eu quero aqui parabenizar o autor do projeto, o Deputado Alberto Fraga, mas também todos os autores dos apensados ao projeto, inclusive alguns já tramitaram no Plenário do Senado Federal. Foi uma atitude nobre da Comissão, desta Casa, através do Presidente da Comissão Lucas, a quem eu agradeço muitíssimo, juntamente com a equipe legislativa da Câmara, do meu partido, PSDB, da minha equipe, que me deu todo o suporte. São 10 anos de história nesta Casa. E uma das injustiças praticadas foi lá na reforma da Previdência, quando naquela oportunidade nós votamos equivocadamente, retirando a aposentadoria especial de mais ou menos 6% dos trabalhadores deste País. Que categorias são essas? Não contemplei categorias, mas todos os trabalhadores expostos a agentes nocivos. Exemplos: mineiros de subsolo, ceramistas, químicos, eletricitários, vigilantes e tantas outras categorias que têm suas áreas de trabalho, seu ambiente de trabalho insalubre, com agentes nocivos.",GEOVANIA_DE_SÁ,PSDB,SC
3601193,"Eu digo que comparar um trabalhador de escritório, que está no ar-condicionado, numa mesa, num computador, a um trabalhador que está numa mina de subsolo, é muito diferente; ou a uma ceramista, enfrentando o calor, enfrentando outros agentes.",GEOVANIA_DE_SÁ,PSDB,SC
3601193,"Eu quero dizer que é um momento muito nobre, é um momento emocionante. Com certeza, esses trabalhadores aguardavam essa aprovação hoje, por unanimidade, na Comissão do Trabalho. O projeto segue para outras Comissões, mas eu vim à tribuna, Sr. Presidente, e já vou encerrar, mas quero pedir, com muita sensibilidade, ao Presidente da Casa, que é sensível aos trabalhadores do País, que traga a este Plenário o PLP 42, de 2023, para que esta Casa, este Plenário, possa fazer uma avaliação e votar, para darmos a resposta, o mais rápido possível, aos trabalhadores deste País, principalmente àqueles que tinham aposentadoria especial antes da Emenda Constitucional nº 103.",GEOVANIA_DE_SÁ,PSDB,SC
3601193,"Por isso, Sr. Presidente, muito obrigada.",GEOVANIA_DE_SÁ,PSDB,SC
3601193,"Peço encarecidamente ao Presidente da Casa que traga a matéria ao Plenário. Parabenizo os trabalhadores por esse passo importante que, no dia de hoje, a Comissão do Trabalho, a Câmara dos Deputados deram. E vamos continuar nessa luta.",GEOVANIA_DE_SÁ,PSDB,SC
3601193,"Peço que a aprovação do PLP 42 seja divulgada no programa A Voz do Brasil, bem como em todos os canais de comunicação desta Casa.",GEOVANIA_DE_SÁ,PSDB,SC
3601193,Parabéns aos trabalhadores do Brasil!,GEOVANIA_DE_SÁ,PSDB,SC
3601193,Muito obrigada.,GEOVANIA_DE_SÁ,PSDB,SC
3601219,"- O.K., Deputada Geovania de Sá.",GILBERTO_NASCIMENTO,PSD,SP
3601219,Nós também parabenizamos a senhora.,GILBERTO_NASCIMENTO,PSD,SP
3601219,"Agora, nós vamos ao Estado de Minas Gerais ouvir o Deputado Bruno Farias, autor do Piso da Enfermagem.",GILBERTO_NASCIMENTO,PSD,SP
3601219,Tem V.Exa. a palavra.,GILBERTO_NASCIMENTO,PSD,SP
