id,discurso,nome,siglaPartido,siglaUf
3601488,"Vale destacar que, com a aprovação nestas duas Comissões, ele já seguirá para que o Presidente da República possa sancioná-lo.",DUARTE_JR,PSB,MA
3601488,"Antes que alguém aqui levante qualquer tipo de dúvida sobre a possibilidade ou não do pagamento deste piso, trago dados técnicos, cálculos já realizados, para que possa ser realizado o seu pagamento. De acordo com dados extraídos dos gastos no período de 2019, o valor pago para o piso representará apenas 0,3%, ou seja, um gasto quase insignificante. Para garantir o pagamento do piso dos fisioterapeutas e terapeutas ocupacionais, basta um aporte de mais 0,3%. Ou seja, dinheiro há, é possível pagar, só basta boa vontade. E é isso que esta Casa precisa demonstrar. Vamos lutar até o final para que este piso seja aprovado e para que estes profissionais possam ter este pagamento na prática, para que os fisioterapeutas e terapeutas ocupacionais possam ter maior valorização.",DUARTE_JR,PSB,MA
3601488,"Por fim, Sr. Presidente, peço que este comunicado, esta informação, por ser de importante utilidade pública, seja compartilhado em todos os canais de comunicação desta Casa.",DUARTE_JR,PSB,MA
3601488,Viva os fisioterapeutas! Viva os terapeutas ocupacionais! Viva a saúde!,DUARTE_JR,PSB,MA
3601611,"- O.k., Deputado Duarte Jr., lá do Maranhão. Atendo o pedido de V. Exa., cujo pronunciamento será divulgado em todos os órgãos de comunicação desta Casa.",GILBERTO_NASCIMENTO,PSD,SP
3601611,"E agora nós vamos então ao Rio Grande do Sul, com o Deputado Heitor Schuch. Porém, vejo ali o Deputado Otoni de Paula, ávido por também falar por 1 minuto — porque, logicamente, depois S.Exa. terá o tempo de 3 minutos — para também apresentar uma pessoa muito importante.",GILBERTO_NASCIMENTO,PSD,SP
3601611,"Tem V.Exa. a palavra, Deputado.",GILBERTO_NASCIMENTO,PSD,SP
3601489,"- Presidente Gilberto Nascimento, meu amigo, meu irmão, hoje eu estou muito feliz porque esta Casa do Povo se enche de maior alegria e de maior beleza quando Silvana está comigo aqui no Parlamento.",GILBERTO_NASCIMENTO,PSD,SP
3601587,"Silvana é nordestina, paraibana, eu a conheci no Rio de Janeiro. Apaixonei-me quando ela cantava Jesus Cristo mudou meu viver, e eu dizia: ""E você mudou o meu"". Graças a Deus, Silvana está hoje nos acompanhando aqui. Deus abençoe as famílias do Brasil e todos aqueles que investem na sua família.",OTONI_DE_PAULA,MDB,RJ
3601587,"Sempre valerá a pena lutar pela sua família, e nenhum sucesso de um homem vale o sacrifício do seu lar.",OTONI_DE_PAULA,MDB,RJ
3601587,"Muito obrigado, Deputado Gilberto Nascimento.",GILBERTO_NASCIMENTO,PSD,SP
3601653,"- Parabéns, Deputado Otoni, parabéns, Silvana. Vocês realmente formam um perfeito casal abençoador de vidas.",GILBERTO_NASCIMENTO,PSD,SP
3601653,"Conheço o Deputado Otoni desde muito jovem. Enquanto vocês completam 27 anos de casados, eu já estou completando 47. Mas, quando eu completar 50 anos de casado, o que será breve, vocês serão meus convidados também em São Paulo. Deus abençoe vocês, Silvana. Deus abençoe você e o Otoni.",GILBERTO_NASCIMENTO,PSD,SP
3601653,"Parabéns por entender esse grande ministério que o nosso Deputado Otoni tem na vida, que é representar o povo do Estado do Rio de Janeiro.",GILBERTO_NASCIMENTO,PSD,SP
3601653,"Ok, vamos agora ao Rio Grande do Sul com o Deputado Heitor Schuch. Tem a palavra V.Exa.",GILBERTO_NASCIMENTO,PSD,SP
3601588,"- Sr. Presidente, colegas Deputados e Deputadas e estimado povo brasileiro, quero fazer desta tribuna um espaço para mostrar minha indignação, minha insatisfação e o meu repúdio com a resolução do Conselho Monetário Nacional, ou melhor, as três resoluções do Conselho, que liquidam o PROAGRO, o seguro para a agricultura familiar poder produzir com mais tranquilidade.",HEITOR_SCHUCH,PSB,RS
3601588,"Quem não nos ouviu falar aqui nos últimos tempos de que o Rio Grande do Sul teve três safras prejudicadas pela seca; teve gente, teve catástrofe, teve morte. E aí, quando precisamos, enquanto agricultor e empreendedor rural, do seguro agrícola, as regras mudam no meio do jogo, e isso não dá para aceitar.",HEITOR_SCHUCH,PSB,RS
3601588,"Trouxe uns números para ilustrar: em 2023, foram 160 mil contratos, ou seja, 160 mil agricultores que contrataram o seguro. Pagaram a sua parte para ter a cobertura de 2,5 milhões de hectares. Estou falando do Rio Grande do Sul, mas precisamos ampliar esses números para outros Estados que têm a mesma política federal. O PROAGRO e o PROAGRO Mais, portanto, são os principais instrumentos de mitigação de riscos escolhidos pelos agricultores para proteger as suas lavouras.",HEITOR_SCHUCH,PSB,RS
3601588,"Quero reiterar aqui que, quando nós falamos de PROAGRO — que talvez para o Governo seja um pouco caro porque tem dado muita intempérie — é muito barato e será muito mais barato enquanto nós pudermos produzir o alimento que vai à mesa do povo brasileiro, porque se o agricultor brasileiro não fizer isso, amanhã ou depois, talvez tenhamos que importar alimentos. Aí, sim, nós vamos pagar um preço além da conta.",HEITOR_SCHUCH,PSB,RS
3601588,"Quero reiterar aqui a manifestação recebida da CONTAG, do Presidente Aristides, Presidente Carlos Joel da Silva, da FETAG, que essas resoluções excluem milhares de agricultores do PROAGRO e da Garantia-Safra.",HEITOR_SCHUCH,PSB,RS
3601602,"Nesse cenário, Presidente, é preciso deixar claro aos brasileiros, que não estão lá no campo, que as resoluções vêm em prejuízo do campo e o que o Governo fez, através do Conselho Monetário Nacional, não coopera para a produção de alimentos saudáveis. Reduzir o limite de enquadramento e reduzir os limites de garantia andam na contramão do desenvolvimento rural e da política pública. O Conselho Monetário Nacional, Presidente, precisa revogar isso de forma urgente, imediata, para que a agricultura possa continuar produzindo.",HEITOR_SCHUCH,PSB,RS
3601602,"Reitero aqui que já pedimos uma audiência pública na Comissão da Agricultura desta Casa para discutir o assunto e também uma audiência com o Ministro da Fazenda, para que nós possamos, junto com os movimentos da agricultura, que estão no campo, do agrofamiliar, debater esse assunto e suspender essa resolução do Conselho Monetário Nacional.",HEITOR_SCHUCH,PSB,RS
3601603,"- O.k., Deputado Heitor Schuch, do nosso Rio Grande do Sul.",GILBERTO_NASCIMENTO,PSD,SP
3601603,"E agora, do Rio Grande do Sul, nós vamos ao Rio de Janeiro. No Rio de Janeiro, nós vamos ouvir o Deputado Reimont.",GILBERTO_NASCIMENTO,PSD,SP
3601603,"Enquanto o Deputado vai à tribuna, nós vamos ouvir, por 1 minuto, o Coronel Assis. Tem V.Exa. a palavra.",GILBERTO_NASCIMENTO,PSD,SP
3601604,"- Sr. Presidente, realmente o Brasil é o País das cortinas de fumaça. Estamos com inúmeras situações acontecendo em nosso País e nada se fala.",CORONEL_ASSIS,UNIÃO,MT
3601604,"O filho do Presidente da República diz que está chateado com a ex-mulher, que o acusou de agressão. O IBAMA está paralisado já faz três meses. A área queimada, no Brasil, cresceu 410% em fevereiro. O Brasil atinge recorde histórico de mortes por dengue. O déficit recorde nas contas públicas, em fevereiro, chega a 58 bilhões de reais. O Brasil assumiu o posto de pior mercado de ações do mundo. O Brasil poupa o Irã em resolução na ONU para investigar crimes contra os direitos humanos. Espião russo é descoberto em embaixada de Brasília recrutando informantes. Servidores públicos federais entram em greve no Brasil inteiro. E o Ministro do Governo atual da gestão federal, Rui Costa, é citado em delação sobre fraude na saúde da Bahia. Realmente estamos vivendo uma grande crise em nosso País. Obrigado, Sr. Presidente.",CORONEL_ASSIS,UNIÃO,MT
3601686,"- Depois do Deputado Coronel Assis, do Mato Grosso, agora, sim, vamos ao Rio de Janeiro com o Deputado Reimont. Tem V.Exa. a palavra.",GILBERTO_NASCIMENTO,PSD,SP
3601605,"- Presidente, quero cumprimentá-lo e cumprimentar também todos os Deputados.",REIMONT,PT,RJ
3601605,"Vou continuar aqui falando da crise do Brasil. Sobre a crise do Brasil hoje, que anunciaram ter ocorrido lá no Palácio do Planalto, para vocês, que são amantes do agouro, que são aves do agouro, que não conseguem ver nenhuma movimentação do Governo que seja positiva, tenho aqui uma notícia: hoje o Presidente Lula reuniu-se com os movimentos sociais. E é bom lembrar que o Presidente passado só reunia-se no cercadinho com a imprensa.",REIMONT,PT,RJ
3601605,"No entanto, o Governo Presidente Lula hoje lotou o segundo andar do Palácio do Planalto com os movimentos sociais para anunciar o Programa Minha Casa, Minha Vida com duas modalidades: a modalidade Entidades, que é aquela organizada pelos movimentos sociais, autogestão, construção em mutirão — para o qual nós estamos falando de 37 mil unidades, 37 mil unidades, a um custo de 6 bilhões de reais; e o outro modelo, Minha Casa, Minha Vida Rural, com 75 mil unidades, no valor de 5 bilhões e 600 milhões de reais.",REIMONT,PT,RJ
3601732,"Só o meu Estado, Rio de Janeiro, tem inscritas no anúncio de hoje 916 unidades. Para aqueles que acham que o Governo passado fez alguma coisa para o País — no meu Estado, o Governo Bolsonaro não implantou uma casa sequer —, quero dizer, no linguajar do nosso Estado, que ele não bateu um prego no Estado, nada, zero. O que fez foi disseminar fake news, disseminar aquilo que chamamos de negacionismo, negando vacina ao povo e levando o povo à morte.",REIMONT,PT,RJ
3601732,"Pois bem, o Presidente Lula fez esse anúncio hoje, que eu queria trazer hoje aqui, porque é muito importante para nós.",REIMONT,PT,RJ
3601732,"Aqueles que são da Oposição pelo menos coloquem a mão na consciência e compreendam que o déficit habitacional do Brasil está sendo enfrentado pelo Governo do Presidente Lula. Hoje havia lá inclusive Deputados do campo da Oposição, que criticam para caramba o Governo, mas que entendem que essa é uma medida importante para nós.",REIMONT,PT,RJ
3601732,"Nesses últimos segundos que me restam, Sr. Presidente, eu quero lembrar aqui que hoje, na Comissão de Trabalho — o Deputado Duarte Jr. já falou sobre isso aqui —, foi votado o piso dos profissionais de fisioterapia e de terapia ocupacional. Quero mandar o meu abraço ao COFFITO — Conselho Federal de Fisioterapia e Terapia Ocupacional, portanto, do Brasil inteiro. Mas quero também mandar um abraço especial ao CREFITO 2, do Rio de Janeiro, aos trabalhadores da fisioterapia e da terapia ocupacional, dizendo-lhes da importância da luta deles para a saúde brasileira, para todo o povo brasileiro, porque a fisioterapia salva vidas e é muito importante para todos nós.",REIMONT,PT,RJ
3601732,"Por fim, Sr. Presidente, nesses 20 segundos que me restam, quero dizer aqui que temos que enfrentar, de peito aberto, os avanços da extrema direita agora alardeados pelo Elon Musk, que diz que vai desrespeitar as leis brasileiras, e há muitos Deputados aceitando isso. Nós fazemos as leis e aplaudimos aqueles que prometem desrespeitá-las. Que vergonha ouvir alguns Deputados falarem isso!",REIMONT,PT,RJ
3601732,"O senhor Elon Musk que faça o repúdio, por exemplo, à Arábia Saudita, ele que faça a lembrança do Apartheid da África de Sul, de onde ele é proveniente.",REIMONT,PT,RJ
3601732,"Sr. Presidente, sigamos juntos. Um grande abraço.",REIMONT,PT,RJ
3601732,Muito obrigado a todos e todas. Paz e bem!,REIMONT,PT,RJ
3601733,"- O.k., Deputado Reimont, do Rio de Janeiro.",GILBERTO_NASCIMENTO,PSD,SP
3601733,"Vamos agora ao Mato Grosso do Sul, para ouvir o Deputado Dr. Luiz Ovando. Enquanto o Deputado se dirige à tribuna, nós vamos passar ali pelo Tocantins, para ouvir o nosso Presidente da Frente Parlamentar Evangélica, Deputado Eli Borges.",GILBERTO_NASCIMENTO,PSD,SP
3601733,Tem V.Exa. a palavra.,GILBERTO_NASCIMENTO,PSD,SP
3601734,"- Presidente, eu gosto muito de ouvir o que se fala neste Parlamento e gosto muito do alto nível das propagandas do Governo.",ELI_BORGES,PL,TO
3601734,"No ano passado, por exemplo, foi anunciado o maior Plano Safra do Brasil, de 360 bilhões de reais. Mas quem foi ao banco viu que o dinheiro não chegou lá.",ELI_BORGES,PL,TO
3601734,"Agora foi anunciada uma resolução. Basicamente, já há um modelo do agronegócio, os bancos já operam basicamente aquela resolução, praticamente sem novidade. No meu Estado, por exemplo, os produtores de soja, que não tinham chuva até o mês de dezembro, e outros que convivem agora com o excesso de chuva, não estão no pacote, não sabem o que fazer para pagar as contas do banco.",ELI_BORGES,PL,TO
3601614,"No agronegócio há uma verba chamada custeio. A resolução não alcançou essa verba chamada custeio. Esses bons clientes que sustentam a economia brasileira, que puxam a economia brasileira no agronegócio estão em crise porque não conseguem pagar o banco e não foram enquadrados na resolução. Isso é muito grave! É preciso fazer um trabalho para a inclusão de todos que precisam renegociar suas dívidas e não perder o seu crédito para continuar produzindo para o Brasil e gerando divisas para o Brasil.",ELI_BORGES,PL,TO
3601614,"Muito obrigado, Presidente.",ELI_BORGES,PL,TO
3601615,"- O.k., Deputado Eli Borges, lá do nosso Tocantins.",GILBERTO_NASCIMENTO,PSD,SP
3601615,"Agora, sim, nós vamos ao Mato Grosso do Sul com o Deputado Dr. Luiz Ovando.",GILBERTO_NASCIMENTO,PSD,SP
3601615,Tem V.Exa. a palavra.,GILBERTO_NASCIMENTO,PSD,SP
3601616,"- Sr. Presidente Gilberto, é uma satisfação muito grande estar aqui e vê-lo à frente dos trabalhos desta Casa. Eu volto aqui após algum tempo e quero dizer aqui que isso motivado exatamente pelos desafios que estão colocados hoje para a Nação brasileira, principalmente para a Câmara Federal.",DR_LUIZ_OVANDO,PP,MS
3601616,"Nós temos visto constantemente um atropelar das leis pelo Supremo Tribunal Federal, infelizmente. O art. 102 tem sido esquecido e, lamentavelmente, isso tem repercutido principalmente sobre a liberdade das pessoas, porque estão com medo, medo de determinados Ministros ali do Supremo Tribunal Federal. Agora, nós vemos alguém de fora, um estrangeiro, colocando-se numa posição de defesa dos interesses, assumindo, inclusive, o papel que o Senado deveria, de forma intocável, assumir e defender os interesses do povo brasileiro. Infelizmente, isso não tem sido feito.",DR_LUIZ_OVANDO,PP,MS
3601616,"Hoje, nós estamos aqui na Câmara Federal para, dentro de alguns minutos, talvez horas, votarmos sobre a liberação daquele Deputado que foi preso pela determinação de um Ministro do Supremo Tribunal Federal. Eu quero dizer aqui e esclarecer de forma contundente que nós não fomos colocados na posição de juiz pelo povo brasileiro, aqueles que nos elegeram, os nossos representados. Eu quero dizer que nós fomos colocados aqui para zelar pelo Legislativo, e assim nós vamos fazer e, principalmente, destacar o art. 49, que diz respeito às prerrogativas das ações legislativas.",DR_LUIZ_OVANDO,PP,MS
3601616,"Eu quero deixar claro aqui que é fundamental que nós, Deputados Federais, votemos pela liberdade do Congresso. Caso contrário, esta será a última oportunidade, infelizmente, que teremos de ter nas mãos a capacidade de decidir e modular as ações de determinados poderes que têm extrapolado nas suas ações.",DR_LUIZ_OVANDO,PP,MS
3601616,"Muito obrigado, Sr. Presidente.",DR_LUIZ_OVANDO,PP,MS
3601598,"- Obrigado, Deputado Dr. Luiz Ovando. Agora nós vamos ouvir o Deputado Ricardo Maia. Logo em seguida, vamos ouvir a Deputada Natália Bonavides.",GILBERTO_NASCIMENTO,PSD,SP
3601598,Tem a palavra o Deputado Ricardo Maia.,GILBERTO_NASCIMENTO,PSD,SP
3601599,"- Sr. Presidente, Srs. Parlamentares, neste último final de semana tivemos chuvas fortes no sertão da Bahia, fazendo com que o açude de Cocorobó transbordasse, o que trouxe inundações para o Município de Canudos — a terra de Antônio Conselheiro — levando embora as irrigações. Nesse mesmo trajeto, a inundação chegou ao rio Vaza-Barris, levando-a até a cidade de Jeremoabo, uma inundação que não se via há mais de 40 anos. Levamos ao Ministro Waldez Góes solicitação de atendimento aos dois Municípios, que precisam urgentemente da intervenção do Governo do Estado e do Governo Federal para poderem voltar à normalidade da vida. Houve muitos prejuízos na agricultura, para o pequeno agricultor quanto à sustentabilidade da sua economia.",RICARDO_MAIA,MDB,BA
3601599,"Mas, Sr. Presidente, hoje foi um dia de muita felicidade para o povo do nosso Brasil, pois tivemos a retomada do programa Minha Casa Minha Vida rural e entidades. Às vezes, a quem mora em uma casa confortável, sendo Parlamentar ou não, é fácil usar a tribuna. Mas é difícil se saber a necessidade das pessoas do País que, durante muitos e muitos anos, viram estacionado o programa Minha Vida Minha Vida rural e entidades. São pessoas que precisam dessas unidades habitacionais. E hoje o nosso Presidente Luiz Inácio Lula da Silva assinou várias contratos para que tenhamos casas para todo o nosso País, especialmente para a minha Bahia, para o meu torrão, o meu sertão, para onde levamos 200 unidades habitacionais para a cidade de Heliópolis: 150 rurais e 50 do Minha Casa Minha Vida. Da mesma forma, levamos também para a cidade de Fátima: 150 casas para residência rural e 50 para a sede. Mais 50 casas para a unidade habitacional rural em Ribeira do Pombal, em Elísio Medrado, a terra em que meu filho é Prefeito; Tucano também será contemplado com 100 unidades habitacionais também do Minha Casa Minha Vida rural e entidades.",RICARDO_MAIA,MDB,BA
3601599,"E é esse contexto de felicidade que nos faz ser um Parlamentar, para participarmos de um momento histórico como esse. Sou uma pessoa que votou desde 1994 no Presidente Lula, e hoje estou ao lado dele na assinatura desses contratos, trazendo mais dignidade para o nosso povo.",RICARDO_MAIA,MDB,BA
3601599,"Sr. Presidente, eu vejo muito nas mídias, vejo muito na tribuna se falar do Ministro Rui Costa. O Ministro Rui Costa foi Governador do nosso Estado da Bahia por 8 anos. Um Governador que, em 2014, se apresentou com 5% das intenções de votos numa pesquisa, e lá convenceu o grupo político que formatou a sua candidatura e ele se elegeu Governador. Fez um trabalho excelente nos quatro cantos do nosso Estado, desenvolvendo a área da saúde, tendo conseguido se reeleger, agora com um patamar de 75% dos votos válidos na nossa terra.",RICARDO_MAIA,MDB,BA
3601599,"Para concluir, Sr. Presidente, é com muita honra que nós, baianos e baianas, tivemos o nosso Ministro Rui Costa como Governador por 8 anos, trazendo desenvolvimento para o nosso Estado. E os frutos desses 8 anos são colhidos até hoje, quando a Bahia foi entregue ao nosso Governador Jerônimo com diversas escolas modernizadas. De fato, o Governador Rui Costa cuidou do povo baiano.",RICARDO_MAIA,MDB,BA
3601599,"Tendo que se livrar, querendo fugir da cadeia, através de uma delação premiada, uma senhora cita o nome de um dos homens mais importantes do nosso País, no momento em que este homem está ao lado do nosso Presidente Luiz Inácio Lula da Silva formatando gestão, formatando governança para, assim, desenvolver este Brasil.",RICARDO_MAIA,MDB,BA
3601625,"- Depois do nosso Deputado Ricardo Maia, da Bahia, agora nós vamos ao Rio Grande do Norte com a Deputada Natália Bonavides.",GILBERTO_NASCIMENTO,PSD,SP
3601625,"Enquanto a Deputada dirige-se à tribuna, o nosso Deputado Reimont também pediu 1 minuto.",GILBERTO_NASCIMENTO,PSD,SP
3601625,Tem V.Exa. a palavra.,GILBERTO_NASCIMENTO,PSD,SP
3601626,"- Presidente, muito obrigado por ceder-me 1 minuto.",REIMONT,PT,RJ
3601626,"Eu quero registrar a presença do meu irmão Reginaldo, que está nos visitando aqui.",REIMONT,PT,RJ
3601626,"O Reginaldo é funcionário da Caixa Econômica Federal e é um daqueles que, com o povo das Minas Gerais, tem lutado muito para a conservação da Caixa Econômica 100% pública.",REIMONT,PT,RJ
3601626,"Nós temos essa grande tarefa. Nós vivemos um momento no Governo Bolsonaro, em que a Caixa Econômica quase, quase, quase, quase foi entregue. Nós, então, fizemos e continuamos fazendo essa luta para que a Caixa, com tudo aquilo que ela tem, inclusive com as loterias, permaneçam com a Caixa, porque nós sabemos da sua importância.",REIMONT,PT,RJ
3601626,Registro a presença do Reginaldo no nosso Parlamento e agradeço a sua a visita.,REIMONT,PT,RJ
3601626,"Muito obrigado, Sr. Presidente.",REIMONT,PT,RJ
3601687,"- Deputado Reimont, primeiro, quero dar as boas-vindas também ao seu ilustre visitante nesta tarde e parabenizá-lo por ter também um grande representante aqui nesta Casa, como o Deputado Reimont que representa tão bem o nosso Rio de Janeiro.",GILBERTO_NASCIMENTO,PSD,SP
3601687,Sejam felizes!,GILBERTO_NASCIMENTO,PSD,SP
3601687,Uma boa tarde ao senhor.,GILBERTO_NASCIMENTO,PSD,SP
3601687,"Agora, vamos ao Rio Grande do Norte, com a nossa Deputada Natália Bonavides.",GILBERTO_NASCIMENTO,PSD,SP
3601687,Tem V.Exa. a palavra.,GILBERTO_NASCIMENTO,PSD,SP
3601627,"- Obrigada, Presidente.",NATÁLIA_BONAVIDES,PT,RN
3601627,"Sr. Presidente, eu gostaria aqui de manifestar o nosso apoio à luta que sindicatos de servidores, como o SINSENAT, o SINDJUSTIÇA, estão travando para resolver uma injustiça que está sendo praticada contra toda uma geração de servidores públicos que dedicou suas vidas para prestar um serviço público de qualidade.",NATÁLIA_BONAVIDES,PT,RN
3601627,"Eu me refiro à situação que o STF decidiu que servidores que ingressaram no serviço público antes de 1.988 não teriam os mesmos direitos que aqueles que ingressaram após, não teriam os mesmos direitos de aposentadoria, de regras de progressão. Isso irá provocar um enorme caos no serviço público, porque ao redor de todo o País, nós temos a possibilidade de uma crise que quebra, inclusive, a expectativa de toda uma geração de servidores.",NATÁLIA_BONAVIDES,PT,RN
3601627,"No meu Estado, por exemplo, a consequência dessa decisão foi que o Tribunal de Contas estabeleceu um prazo limite para que esses servidores antigos pudessem se aposentar. Essa decisão até foi suspensa pelo STF, através de uma liminar, mas imaginem a situação de insegurança que persiste hoje em dia na vida dos servidores. Afinal, trata-se apenas de uma liminar.",NATÁLIA_BONAVIDES,PT,RN
3601627,"Em Natal, caso os servidores antigos precisem aposentar-se, vai ocorrer que, de uma vez só, mais de 1.500 servidores municipais, mais de 3 mil servidores estaduais vão deixar o serviço público. Isso fará com que as pessoas com mais de 60 anos, que é o perfil da maioria dessas pessoas atingidas, percam uma parte importantíssima da sua renda, em uma idade que, inclusive, é difícil realocação profissional. Além disso, poderia parar importantes serviços públicos, porque seria impossível repor essa quantidade de servidores de uma vez só. Além disso, tem um impacto econômico para cidades, como a minha cidade de Natal, que tem uma parte importante dos trabalhadores empregados no serviço público. E, mesmo com a suspensão daquela decisão por uma liminar, é uma injustiça que persiste. E persiste pela insegurança de ter parte dos seus direitos sendo preservados somente por uma liminar. E a questão não é só aposentadoria. Há direitos, como o de progressão funcional, que estão sendo retirados desses servidores que dedicaram suas vidas ao serviço público.",NATÁLIA_BONAVIDES,PT,RN
3601592,"Então, eu peço o apoio da Mesa, das Deputadas e dos Deputados presentes, para que nós aprovemos o mais breve possível as PECs que tratam sobre esse tema, como a PEC 422, de 2014, para garantirmos que esses servidores não vejam minguar a sua fonte de renda e para assegurar a continuidade da prestação do serviço público.",NATÁLIA_BONAVIDES,PT,RN
3601592,"Se o Presidente me der mais 1 minuto, eu gostaria de tratar aqui de um tema, ainda, que é deixar o nosso total apoio à luta das servidoras e dos servidores das instituições federais de ensino que estão se mobilizando para fazer aquilo que o Presidente Lula falou que precisava ser feito. Quando Lula anunciou o fim do trabalho da equipe de transição, no final de 2022, ele disse ao País que era preciso que a população cobrasse. E isso, inclusive, foi reiterado por ele, em uma entrevista que ele deu no início deste mês, porque cobrar é ajudar o Governo a achar caminhos. Então, um Governo que é liderado por um sindicalista, um partido que é dos trabalhadores, sabe muito bem a importância da greve para a conquista de direitos.",NATÁLIA_BONAVIDES,PT,RN
3601592,"Por isso, Presidente, eu quero registrar o nosso apoio e o reconhecimento da legitimidade das greves que estão ocorrendo nos institutos federais, como o IFRN, em universidades federais, como a UFRN, porque é a organização de trabalhadores e trabalhadoras que pode fazer, por exemplo, que a maior categoria de servidores do Executivo Federal, como os TAE, os Técnicos Administrativos em Educação, deixem de ser a carreira mais desvalorizada do serviço público. Só a organização de trabalhadores e trabalhadoras vai poder fazer, inclusive, com que a pressão de determinados setores, aqui do Congresso, pelo controle do orçamento, seja revertida para, assim, acabarmos com o sufocamento orçamentário das instituições federais de ensino.",NATÁLIA_BONAVIDES,PT,RN
3601592,"Então, todo o apoio aos trabalhadores e trabalhadoras das instituições federais de ensino. Contem com o nosso mandato nessa luta justa e legítima.",NATÁLIA_BONAVIDES,PT,RN
