id,discurso,nome,siglaPartido,siglaUf
3601755,"Se não tomarmos cuidado, nós vamos continuar fazendo essa matança de animais silvestres. Pet é cachorro e gato, que levaram milhares e milhares de anos para serem domesticados. Assim ocorre também com outras espécies. Então não é natural que haja um passarinho preso, um papagaio, um macaco, uma cobra, uma jaguatirica, uma anta, uma capivara, como um animal doméstico, dentro de casa.",NILTO_TATTO,PT,SP
3601755,"Todos sabem. Por mais que seja criado inclusive em cativeiro, mesmo com o tempo, aquele animal não deixa de ser silvestre e ter as suas reações enquanto animal silvestre.",NILTO_TATTO,PT,SP
3601755,"Por isso, pela própria proteção da biodiversidade e para contribuirmos inclusive com redução da mortandade de animais silvestres, nós precisamos discutir seriamente aqui.",NILTO_TATTO,PT,SP
3601755,Não estou falando daqueles que porventura têm um animal silvestre e que cuidam com carinho desse animal em casa. O que nós precisamos é acabar com uma política que incentiva as pessoas a terem um animal silvestre em casa como se fosse um pet. Por isso é fundamental avançarmos aqui e termos uma legislação aprovando esse projeto de lei para proibir a criação e a comercialização de animais silvestres como pets.,NILTO_TATTO,PT,SP
3601755,"Obrigado, Presidente.",NILTO_TATTO,PT,SP
3602771,"- O.k., Deputado Nilto Tatto, de São Paulo.",GILBERTO_NASCIMENTO,PSD,SP
3602771,"Vamos ouvir o Deputado Rafael Simoes, o Deputado Capitão Alden e o Deputado Marcelo Calero.",GILBERTO_NASCIMENTO,PSD,SP
3602771,"Antes, porém, concedo a palavra ao Deputado Cleber Verde, por 1 minuto.",GILBERTO_NASCIMENTO,PSD,SP
3602772,"- Sr. Presidente, primeiro, quero cumprimentar V.Exa., que hoje preside os trabalhos. É uma honra falar ao microfone desta Casa tendo V.Exa. como Presidente, Deputado Gilberto Nascimento.",GILBERTO_NASCIMENTO,PSD,SP
3602774,- Muito obrigado.,GILBERTO_NASCIMENTO,PSD,SP
3602775,"- Eu quero cumprimentar o Presidente Lula e o Ministro Jader Filho pelo lançamento, hoje, do Minha Casa, Minha Vida Rural e do Minha Casa, Minha Vida Entidades.",CLEBER_VERDE,MDB,MA
3602775,"O Maranhão, Sr. Presidente, é um dos Estados com maior déficit habitacional do Brasil. Com muito trabalho e muita articulação com o Governo, nós buscamos fazer com que o Maranhão fosse contemplado. Pois bem. Nós tivemos 13.710 unidades habitacionais contempladas pelo Programa Minha Casa, Minha Vida Rural para atender a população maranhense. Isso favorecerá não só a habitação em si, mas também a movimentação da economia e a geração de empregos, para levarmos dignidade aos nossos maranhenses.",CLEBER_VERDE,MDB,MA
3602775,Fica registrado aqui o nosso compromisso de continuar trabalhando pelo Brasil e pelo Maranhão.,CLEBER_VERDE,MDB,MA
3602775,"Sr. Presidente, peço a V.Exa. a veiculação deste pronunciamento no programa A Voz do Brasil.",CLEBER_VERDE,MDB,MA
3602775,Muito obrigado.,CLEBER_VERDE,MDB,MA
3602776,"- O.k., Deputado Cleber Verde. Atendendo ao pedido de V.Exa., seu pronunciamento será divulgado em todos os órgãos de comunicação desta Casa.",GILBERTO_NASCIMENTO,PSD,SP
3602776,"Depois de ouvirmos o Deputado Cleber Verde, agora nós vamos ouvir o Deputado Rafael Simoes, das nossas Minas Gerais.",GILBERTO_NASCIMENTO,PSD,SP
3602776,Tem V.Exa. a palavra.,GILBERTO_NASCIMENTO,PSD,SP
3602773,"- Sr. Presidente, colegas Parlamentares, há mais de 1 ano nós temos denunciado nesta tribuna a crise por que passa o setor leiteiro.",RAFAEL_SIMOES,UNIÃO,MG
3602773,"Presidente, o setor leiteiro está presente em 99% dos nossos Municípios e é composto, em sua maioria, por pequenos e médios produtores. Essa crise se alonga e, lamentavelmente, não vemos o Governo Federal tomar uma atitude no sentido de acudir essas pessoas.",RAFAEL_SIMOES,UNIÃO,MG
3602773,"Agora as coisas estão indo além. Na semana passada, no recesso branco, eu tive a oportunidade de visitar várias cidades da minha querida região sul de Minas, cidades que têm como atividade principal a agropecuária. Eu constatei que a crise que estava no segmento do leite caminha para o segmento da carne, para o segmento do milho, para o segmento da soja. Mesmo assim, não vemos nenhuma ação efetiva do Governo para acudir o nosso agronegócio — aliás, é o agronegócio que mantém o PIB deste País. Nós escutamos o anúncio de projeto disso, de projeto daquilo, mas nada sai do papel. É importante que o Governo passe a olhar com muito cuidado para o agronegócio, principalmente para os pequenos e o médios produtores, que não estão aguentando mais.",RAFAEL_SIMOES,UNIÃO,MG
3602773,"Agora anunciaram que vão permitir refinanciamento de investimentos. Ora, se o sujeito não está dando conta de pagar o dinheiro que pegou para fazer a safra, que dirá para fazer investimentos! Não dá mais! Percebe-se claramente que o Governo está desgovernado — desgovernado!",RAFAEL_SIMOES,UNIÃO,MG
3602773,"Nós Parlamentares temos a obrigação de acudir o nosso povo, principalmente, Deputado Junio Amaral, nós que somos mineiros, que somos do Estado que tem o maior número de produtores de leite.",RAFAEL_SIMOES,UNIÃO,MG
3602773,"Nessa cadeia, nós temos 1,2 milhão de pessoas envolvidas. Em todo o sistema, há mais de 10 milhões de pessoas envolvidas. Parece que isso não tem muita importância. Parece que o importante é vir aqui toda hora e dizer que o Governo fez isso, que o Governo fez aquilo — no papel! Eu gostaria muito que tudo isso que dizem que o Governo fez para lá ou para cá saísse do papel. É preciso que se resolva isso lá na base. Nós Parlamentares estamos sendo cobrados a todo momento. Cobram uma solução como se nós tivéssemos a caneta.",RAFAEL_SIMOES,UNIÃO,MG
3602777,"Eu quero dizer àquela população rural que nós estamos pedindo ao Governo que olhe por nós, para que, de forma resiliente, continuemos trabalhando e produzindo comida para pôr na mesa da população.",RAFAEL_SIMOES,UNIÃO,MG
3602777,"Eu costumo dizer, Deputado Chico, que todas as profissões são extremamente importantes, mas há uma de que nós precisamos todos os dias, mais de uma vez: a de produtor rural. Ele merece um olhar especial.",RAFAEL_SIMOES,UNIÃO,MG
3602777,"Presidente, eu termino pedindo que a minha fala seja divulgada no programa A Voz do Brasil. Esperamos que o Governo tenha, de fato, um olhar carinhoso para os nossos produtores rurais.",RAFAEL_SIMOES,UNIÃO,MG
3602777,Muito obrigado.,RAFAEL_SIMOES,UNIÃO,MG
3602778,"- O.k., Deputado Rafael Simoes, lá das nossas Minas Gerais. Atendendo ao pedido de V.Exa., seu pronunciamento será divulgado em todos os órgãos de comunicação desta Casa.",GILBERTO_NASCIMENTO,PSD,SP
3602778,"Nós vamos ouvir, na sequência, os Deputados Capitão Alden, Marcelo Calero, Flávio Nogueira e Welter.",GILBERTO_NASCIMENTO,PSD,SP
3602778,"Antes, eu vou fazer um pedido aos colegas. O Deputado Chico Alencar, um dos mais experientes Deputados desta Casa, está sem almoço até agora. Então, nós vamos chamar dois Deputados e depois vamos chamá-lo. Nós vamos priorizá-lo, para que, nessa idade, não fique sem almoço, almoce no momento certo. Já, já S.Exa. poderá vir à tribuna.",GILBERTO_NASCIMENTO,PSD,SP
3602778,"Deputado Marcelo Calero, vamos ouvir o Deputado Capitão Alden, o Deputado Chico e depois V.Exa. Pode ser? Vamos fazer assim, então.",GILBERTO_NASCIMENTO,PSD,SP
3602778,"Deputado Capitão Alden, tem V.Exa. a palavra.",GILBERTO_NASCIMENTO,PSD,SP
3602779,"- Sr. Presidente, Srs. Deputados, hoje esta Casa terá, mais uma vez, a oportunidade de dizer se efetivamente respeita a Constituição Federal. Aliás, todos nós, quando fomos empossados Deputados Federais, juramos defender a Constituição Federal.",CAPITÃO_ALDEN,PL,BA
3602779,"Enquanto os comunistas e o pessoal de extrema esquerda falam o tempo todo em liberdade, em democracia, dizem que o pessoal de direita é extremista, é golpista; nós, a todo momento, repetimos que sempre respeitamos a Constituição Federal. Eles ficam usando palavras de efeito para fazer discurso bonito sobre liberdade e democracia, mas, na hora de votar, não votam com respeito à democracia.",CAPITÃO_ALDEN,PL,BA
3602779,"Sr. Presidente, a Constituição Federal é muito clara quando, em seu art. 53, § 2º, diz que o Parlamentar, uma vez diplomado, não poderá ser preso, salvo em flagrante de crime inafiançável. Abrir mão dessa prerrogativa é dar carta branca ao STF, em especial, para que faça o que quiser conosco.",CAPITÃO_ALDEN,PL,BA
3602779,Nós somos contra todo tipo de criminoso. Que esse Deputado que ora será julgado por esta Câmara seja julgado conforme a legislação penal!,CAPITÃO_ALDEN,PL,BA
3602780,"Se dependesse de mim, no Brasil haveria pena de morte para vagabundo, haveria pena de morte para criminoso, para estuprador. Como não depende de mim, devo obedecer ritualmente à Constituição Federal.",CAPITÃO_ALDEN,PL,BA
3602780,"Vamos defender aqui a Constituição Federal. Vamos torcer para que a Câmara vote respeitando a Constituição Federal, para que não sejamos os próximos perseguidos.",CAPITÃO_ALDEN,PL,BA
3602780,"Está muito claro no art. 49, inciso X, da Constituição Federal, que cabe aos Parlamentares fiscalizar os atos do Poder Executivo, mas o STF diz que, para o Parlamentar fiscalizar os atos do Poder Executivo, isso tem que ser feito via Comissão, ou seja, o Parlamentar não pode fiscalizar individualmente os atos do Poder Executivo. Eles entendem ao arrepio da lei.",CAPITÃO_ALDEN,PL,BA
3602780,"Se nós votarmos pela manutenção da prisão de um Deputado Federal sem a devida obediência ao rito e ao processo legislativo, se nós efetivamente mantivermos essa prisão, iremos de encontro à Constituição Federal e daremos um cheque em branco para que o STF faça de nós o que quiser.",CAPITÃO_ALDEN,PL,BA
3602780,"Hoje nós analisaremos o caso desse Deputado que cometeu um crime hediondo e, de forma violenta, causou a morte de uma Vereadora. Repudiamos esse ato de violência e queremos que ele seja condenado, mas é necessário que seja cumprido o devido processo legal.",CAPITÃO_ALDEN,PL,BA
3602783,"- O.k., Deputado Capitão Alden.",GILBERTO_NASCIMENTO,PSD,SP
3602783,"Enquanto o Deputado Chico Alencar vai à tribuna, tem a palavra, por 1 minuto, o Deputado Raniery Paulino.",GILBERTO_NASCIMENTO,PSD,SP
3602783,"Em seguida, nós vamos ouvir também o Deputado Marcelo Calero.",GILBERTO_NASCIMENTO,PSD,SP
3602781,"- Hoje, 10 de abril, é o Dia da Engenharia. Por isso, eu quero cumprimentar o Presidente do Conselho Federal de Engenharia e Agronomia — CONFEA, Vinicius Marchese, e o Conselheiro Federal Joel Krüger.",RANIERY_PAULINO,REPUBLICANOS,PB
3602781,"Quero destacar um projeto de minha autoria, o Projeto de Lei nº 1.014, de 2024, que dispõe sobre a instituição do Programa Nacional Engenheiros para o Brasil, destinado a promover a atuação técnica de profissionais da engenharia para o desenvolvimento de políticas públicas e projetos de infraestrutura na execução dos convênios firmados entre os Municípios e a União. Quero registrar que essa iniciativa foi sugestão do engenheiro civil Filipe Machado, do Espírito Santo.",RANIERY_PAULINO,REPUBLICANOS,PB
3602781,"Precisamos melhorar, cada vez mais, a atuação técnica nesses convênios, para racionalizar e otimizar os serviços públicos.",RANIERY_PAULINO,REPUBLICANOS,PB
3602781,"Renovo o meu respeito aos engenheiros do Brasil, especialmente do meu Estado, a Paraíba.",RANIERY_PAULINO,REPUBLICANOS,PB
3602781,Muito obrigado.,RANIERY_PAULINO,REPUBLICANOS,PB
3602784,"- O.k., Deputado Paulino.",GILBERTO_NASCIMENTO,PSD,SP
3602784,"Vamos agora ao Rio de Janeiro, com o Deputado Chico Alencar, que logo depois vai almoçar. Quando ele for almoçar, nós vamos ouvir o Deputado Marcelo Calero, também do Rio de Janeiro.",GILBERTO_NASCIMENTO,PSD,SP
3602782,"- Obrigado, Presidente Gilberto Nascimento.",GILBERTO_NASCIMENTO,PSD,SP
3602782,"Daqui a pouco, vão me chamar de fisiológico. V.Exa. já disse duas ou três vezes que eu preciso almoçar urgentemente — e preciso mesmo. Aliás, todo o mundo precisa, sem exceção, neste País.",CHICO_ALENCAR,PSOL,RJ
3602785,"A Comissão de Constituição e Justiça e de Cidadania debruçou-se sobre um tema espinhoso durante 5 horas seguidas, desde 10 horas da manhã, para, afinal, aprovar o parecer do Deputado Darci de Matos avalizando aqui a prisão do Deputado Chiquinho Brazão. Não é por espírito de vingança nem por vontade de fazer justiça, que não nos compete, mas, como está previsto no estatuto da imunidade parlamentar, qualquer prisão de Parlamentar Federal tem que ser comunicada à Casa em 24 horas, para a Comissão de Constituição e Justiça dar um parecer e a matéria vir ao Plenário, o que deve acontecer ainda hoje. Espero que tenhamos um quórum robusto, porque ouvi a rádio corredor dizendo que talvez esvaziassem o quórum, o que significaria esvaziar o próprio Poder Legislativo.",CHICO_ALENCAR,PSOL,RJ
3602785,"Lá, o parecer que mantém essa prisão foi aprovado por 39 a 25, depois de intensos debates. No nosso entendimento, do PSOL, com muita razão, não só porque uma parte da nossa bancada é do Rio de Janeiro e conviveu com Marielle — essa violência inaudita nos atingiu a todos e nos machuca até hoje —, mas também porque entendemos que é necessário o aprofundamento das investigações, que há dois domingos atingiram um novo patamar, com a prisão desses que são acusados de mandantes.",CHICO_ALENCAR,PSOL,RJ
3602785,"O Conselheiro do Tribunal de Contas do Estado Domingos Brazão, o Deputado Federal Chiquinho Brazão e o Delegado Rivaldo Barbosa, que chefiou a Polícia Civil, foram presos a partir de investigações muito detalhadas. O relatório da Polícia Federal tem 470 páginas. A decisão do decreto de prisão não foi monocrática. O Ministro Relator Alexandre de Moraes remeteu essa decisão para a Primeira Turma do Supremo Tribunal Federal, composta pela Ministra Cármen Lúcia, pelo Ministro Luiz Fux, pelo Ministro Flávio Dino e por outros Ministros, cujos nomes não me ocorrem agora pelo cansaço.",CHICO_ALENCAR,PSOL,RJ
3602785,"Isso foi aprovado lá. Agora eu espero que seja aprovado aqui. Isso significa valorizar o Parlamento, a Constituição e a democracia. É em torno disso que devemos pensar qualquer situação dessa de acusação contra Parlamentar, com amplo direito de defesa, como aconteceu lá na CCJ, para que possamos avançar para uma estabilidade das nossas instituições democráticas, que a Constituição garante.",CHICO_ALENCAR,PSOL,RJ
3602785,"Muito obrigado, Presidente Gilberto.",CHICO_ALENCAR,PSOL,RJ
3602787,"- O.k., Deputado Chico Alencar, do nosso Rio de Janeiro.",GILBERTO_NASCIMENTO,PSD,SP
3602787,"Vamos continuar no Rio de Janeiro, com o Deputado Marcelo Calero, o homem da cultura do Rio de Janeiro.",GILBERTO_NASCIMENTO,PSD,SP
3602787,"Enquanto o Deputado Marcelo Calero se organiza na tribuna, o nosso Deputado Pompeo de Mattos, nosso colega da Mesa, tem a palavra, por 1 minuto.",POMPEO_DE_MATTOS,PDT,RS
3602786,"- Muito obrigado, Presidente Gilberto Nascimento.",GILBERTO_NASCIMENTO,PSD,SP
3602786,"Eu tomo a liberdade de registrar a presença, na nossa Casa, de duas ilustres personalidades do meu Estado.",POMPEO_DE_MATTOS,PDT,RS
3602786,"O povo gaúcho está muito bem representado aqui pelo Prefeito José Carlos Azeredo, da nossa querida Arroio dos Ratos. Aliás, ele foi Prefeito uma vez, duas vezes, três vezes, com grandes mandatos, e faz uma gestão da qual nós temos um orgulho muito grande.",POMPEO_DE_MATTOS,PDT,RS
3602786,"Junto com ele está o João Pedro Lindner, que é o nosso Secretário de Esportes e também é suplente de Vereador. Ele é uma jovem revelação da política de Arroio dos Ratos, cidade que nós temos ajudado com emendas, com recursos, com verbas, para melhorar a vida e a qualidade de vida do nosso povo na saúde, na educação, na infraestrutura. O Prefeito Azeredo é testemunha disso. Ele, que faz um grande trabalho, sabe: aqui em Brasília, não dão ""Ô de casa!"" em tapera, o campo não tem porteira, a porta não tem tramela. Nós temos caminhado juntos.",POMPEO_DE_MATTOS,PDT,RS
3602788,"Seja bem-vindo, Prefeito José Carlos. Seja bem-vindo, meu amigo Lindner, nosso Vereador. O trabalho de vocês é reconhecido em Arroio dos Ratos, na região do Vale do Caí, no Vale do Carvão, no Rio Grande inteiro e, agora, neste Brasilzão de Deus. Sejam bem-vindos a Brasília. Muito obrigado pelo carinho. Nós estamos juntos trabalhando pelo povo bom e generoso da nossa querida Arroio dos Ratos.",POMPEO_DE_MATTOS,PDT,RS
3602788,"Muito obrigado, Presidente.",POMPEO_DE_MATTOS,PDT,RS
3602790,"- Parabéns, Prefeito José Carlos! Sinta-se muito bem nesta Casa. Que a sua administração seja muito abençoada na sua cidade, no Rio Grande do Sul! Parabéns pela representação que os senhores têm aqui com o nosso querido Deputado Pompeo de Mattos, um exemplo de homem público e gaúcho a ser seguido! Sejam felizes!",GILBERTO_NASCIMENTO,PSD,SP
3602790,Vamos agora ao Rio de Janeiro. Já está na tribuna o Deputado Marcelo Calero.,GILBERTO_NASCIMENTO,PSD,SP
3602790,"Tem V.Exa. a palavra, Deputado Marcelo Calero.",GILBERTO_NASCIMENTO,PSD,SP
3602789,"- Presidente, muito obrigado.",MARCELO_CALERO,PSD,RJ
3602789,"Eu queria lembrar que hoje nós vamos saber se esta Casa efetivamente se dá ao respeito. Hoje nós vamos saber se esta Casa quer, de fato, combater o crime organizado e as milícias ou se esta Casa, ao contrário, quer dar poder aos criminosos. Hoje nós vamos deliberar sobre a prisão do Sr. Chiquinho Brazão.",MARCELO_CALERO,PSD,RJ
3602789,"Vamos lembrar que essa prisão foi resultado de uma ampla investigação feita pela Polícia Federal, que originou um relatório de mais de 450 páginas. Vamos lembrar também que a prisão desse senhor foi referendada por todos os Ministros do Supremo Tribunal Federal — conseguir essa unanimidade nos dias de hoje não é fácil —, inclusive os Ministros que foram indicados por Bolsonaro.",MARCELO_CALERO,PSD,RJ
3602789,"Aqui nós vemos alguns Deputados querendo fazer dessa questão uma disputa entre Direita e Esquerda, uma disputa entre Poder Legislativo e Poder Judiciário. É inacreditável que essa turma que adora dizer que bandido bom é bandido morto e que adora dizer que nós temos que endurecer as regras penais esteja se movimentando nesta Casa para liberar um sujeito suspeito de um dos crimes de maior repercussão da história política do Brasil, se não o de maior.",MARCELO_CALERO,PSD,RJ
3602789,"Por favor, não venham com essas desculpas técnicas que, além de tudo, são falsas. Nós soubemos pelas investigações que se trata, sim, de um crime de flagrante permanente, porque o sujeito estava usando as próprias estruturas do Estado brasileiro, em particular da Polícia Civil do Rio de Janeiro, para acobertar os seus crimes, em conluio com o então Chefe de Polícia Civil. Isso é obstrução da Justiça.",MARCELO_CALERO,PSD,RJ
3602789,"Presidente, nós precisamos entender qual é a mensagem que esta Casa quer passar. Vai haver corporativismo numa hora dessa? É isso o que nós vamos mostrar à sociedade?",MARCELO_CALERO,PSD,RJ
3602789,"Mando um recado àqueles que estão se articulando para não virem ao plenário votar: não se acovardem; mostrem à população qual é a verdadeira relação que vocês têm com a bandidagem; registrem seus votos. Vocês gostam muito de vociferar, de gritar, mas, na hora do vamos ver, vocês arregam.",MARCELO_CALERO,PSD,RJ
3602791,"Eu quero lembrar que o União Brasil, na CCJ, indicou o voto para liberar o Brazão, mas esse mesmo partido, em 24 horas, expulsou o Brazão. Eu queria entender que coerência é essa.",MARCELO_CALERO,PSD,RJ
3602791,"Nós precisamos entender o seguinte: se esse sujeito for liberado, ele vai conviver aqui conosco. Olhem o perigo que isso representa! Esse pessoal não dorme em serviço. Um suspeito de assassinato vai conviver conosco aqui no plenário. Essa é a mensagem que vai passar a Câmara dos Deputados de uma das dez maiores economias do mundo, de uma das maiores democracias do planeta? É isto o que nós queremos mostrar ao mundo: que nós libertamos bandidos?",MARCELO_CALERO,PSD,RJ
3602791,"Obrigado, Presidente.",MARCELO_CALERO,PSD,RJ
3602793,"- O.k., Deputado Marcelo Calero, do Rio de Janeiro.",GILBERTO_NASCIMENTO,PSD,SP
3602793,"Agora nós vamos ao Piauí. No Piauí, nós vamos ouvir o Deputado Flávio Nogueira.",GILBERTO_NASCIMENTO,PSD,SP
3602793,Tem V.Exa. a palavra.,GILBERTO_NASCIMENTO,PSD,SP
3602793,"Logo em seguida, nós vamos voltar ao Paraná, para ouvir o Deputado Welter. Logo depois do Deputado Flávio Nogueira, o Deputado Junio Amaral terá a palavra.",GILBERTO_NASCIMENTO,PSD,SP
3602792,"- Sr. Presidente, Sras. e Srs. Deputados, o Deputado que me antecedeu, Deputado Marcelo Calero, do Rio de Janeiro, lembrou bem uma frase muito usada pela Oposição, que diz que bandido bom é bandido morto. Essa frase é antiga. Foi dita por um policial do Estado da Guanabara que depois criou o Esquadrão da Morte. Vejam bem que tipo de filosofia têm certos políticos da Direita aqui na Câmara, no Congresso Nacional!",FLÁVIO_NOGUEIRA,PT,PI
3602792,"Serve de exemplo a atuação do Ministério da Justiça, através da Polícia Federal, na prisão dos dois fugitivos da Penitenciária Federal de Mossoró e das quatro pessoas envolvidas com a fuga. Se fosse se basear nessa teoria de que bandido bom é bandido morto, a Polícia Federal teria matado logo os dois, teria simulado que eles estariam com um rifle e teriam apontado a arma para os policiais. Se ocorresse isso, nós perderíamos toda a engrenagem do crime. Esses dois fugitivos têm muito a contar. Eles vão decifrar para a Polícia Federal a extensão do crime organizado, que está presente não só na cidade do Rio de Janeiro, no Estado do Rio de Janeiro, mas em todos os rincões do Estado brasileiro.",FLÁVIO_NOGUEIRA,PT,PI
3602792,"O Ministério da Justiça está fazendo o que é preciso e, com inteligência, desmantelará essa organização, para diminuir a criminalidade. Isso é necessário, porque não é boa a imagem que o Brasil está passando para o mundo.",FLÁVIO_NOGUEIRA,PT,PI
3601833,"Então, quero aqui parabenizar sim a Polícia Federal e o Ministério da Justiça pelo procedimento adotado na prisão daqueles elementos criminosos que estavam presos no presídio federal de Mossoró. Sim, ele têm muito o que informar à Polícia Federal.",FLÁVIO_NOGUEIRA,PT,PI
3601833,"Sr. Presidente, peço pois que este meu pronunciamento seja noticiado no programa A Voz do Brasil.",FLÁVIO_NOGUEIRA,PT,PI
3601833,Muito obrigado.,FLÁVIO_NOGUEIRA,PT,PI
3601834,"- O.k., Deputado Flávio Nogueira. Atendendo o pedido de V.Exa., o pronunciamento será divulgado em todos os órgãos de comunicação desta Casa.",GILBERTO_NASCIMENTO,PSD,SP
3601834,"Agora, do Piauí, nós vamos ao Paraná, onde ouviremos o Deputado Welter. Enquanto S.Exa. se dirige à tribuna, vamos ouvir o Deputado Junio Amaral por 1 minuto.",GILBERTO_NASCIMENTO,PSD,SP
3601834,Tem V.Exa. a palavra.,GILBERTO_NASCIMENTO,PSD,SP
3601835,"- Preciso de apenas 1 minuto mesmo, Presidente.",JUNIO_AMARAL,PL,MG
3601835,"Devido processo legal é um termo que a Esquerda usa só quando convém? Essa é uma pergunta sincera, eu queria entender o raciocínio. A Constituição está se tornando cada vez mais um pedaço de papel para servir de referência quando convém?",JUNIO_AMARAL,PL,MG
3601835,"Em 2020, nós abrimos um precedente aqui muito perigoso, com o Daniel Silveira. Evidentemente, eu votei contra a prisão do Parlamentar, que até hoje está sendo injustiçado, por decisões desse ditador chamado Alexandre de Moraes. Agora, a Câmara dos Deputados mais uma vez vai se curvar à decisão desse ditador? Eu voto pelo devido processo legal. Trata-se de coerência. Nós sabemos quem gosta de proteger bandido.",JUNIO_AMARAL,PL,MG
3601847,"- O.k., Deputado Junio Amaral.",GILBERTO_NASCIMENTO,PSD,SP
3601847,"Após S.Exa., vamos agora ao Paraná ouvir o Deputado Welter.",GILBERTO_NASCIMENTO,PSD,SP
3601847,Tem V.Exa. a palavra.,GILBERTO_NASCIMENTO,PSD,SP
3601836,"- Sr. Presidente, Srs. Deputados, é com muita alegria e satisfação que eu venho aqui falar do anúncio de um programa extraordinário que é o Direito à Moradia, que é um direito constitucional. Esse anúncio de hoje só foi possível porque o povo votou em um Presidente da República que olha para o lado social, o lado do povo menos favorecido.",WELTER,PT,PR
3601836,"Hoje, foi anunciado o Minha Casa, Minha Vida na área rural e para entidades — que coisa maravilhosa. Todos os Entes Federados habilitados têm casa para fazer, tanto no sítio como nas cidades, pelas entidades que executam esses projetos. Há 75 mil unidades na República para o meio rural e mais de 35 mil para as entidades executarem. No meu Estado, serão construídas mais de 1200 habitações no meio rural, e as entidades também têm um número próximo a isso. Então, este é um Governo que olha para a nossa gente que mais precisa, a Faixa 1, o povo trabalhador que tem menor renda.",WELTER,PT,PR
3601836,"Se não me falha a memória, verificarei o detalhe do programa, haverá 5,6 bilhões de reais para o Minha Casa, Minha Vida Rural para 75 mil unidades de habitação. E, para o Minha Casa, Minha Vida Entidades, estão programados 6 bilhões de reais. Esse é um programa fantástico para gerar emprego, gerar dignidade para a família, gerar segurança para pais e mães das famílias que têm menor renda.",WELTER,PT,PR
