id,discurso,nome,siglaPartido,siglaUf
3602034,É lógico que ele sabe que os recursos do Estado não dão para atender toda a demanda daqueles e daquelas que lutam pela reforma agrária. Mas ele sabe que o Estado vai cumprir um papel fundamental de ações complementares na questão da reforma agrária.,VALMIR_ASSUNÇÃO,PT,BA
3602034,"Quero parabenizar o Governador por ter ido participar desse evento dos sem-terra, justamente porque ele mostra que, independentemente da luta que você passe, se a sua luta for justa, se a sua luta for digna, tem que ter o apoio do Estado brasileiro.",VALMIR_ASSUNÇÃO,PT,BA
3602034,"E foi justamente isso que o Governador fez. Reconheceu que a reforma agrária é uma necessidade do nosso povo, é uma luta justa, é uma luta que o Estado brasileiro tem que fazer, cumprindo a Constituição Federal. E o Governador foi lá prestar solidariedade e dizer que está ao lado daqueles e daquelas que lutam por democracia, lutam pela reforma agrária.",VALMIR_ASSUNÇÃO,PT,BA
3602034,"Muito obrigado, Presidente.",VALMIR_ASSUNÇÃO,PT,BA
3602034,,VALMIR_ASSUNÇÃO,PT,BA
3602063,"- Muito obrigado, Deputado Valmir Assumpção.",POMPEO_DE_MATTOS,PDT,RS
3602063,"Eu tenho alguns colegas inscritos, mas eu quero chamar aqui ao microfone de aparte dois colegas que estão me pedindo a palavra. Primeiro, o Deputado Gilson Daniel; depois, o nosso honrado pastor Eli Borges.",POMPEO_DE_MATTOS,PDT,RS
3602063,"Deputado Gilson Daniel, tem a palavra V.Exa.",POMPEO_DE_MATTOS,PDT,RS
3602082,"- Muito obrigado, sr. Presidente.",GILSON_DANIEL,PODE,ES
3602082,Eu quero só fazer um registro.,GILSON_DANIEL,PODE,ES
3602082,"Aqui, ao meu lado, está o Vereador Egmar, mais conhecido como Guigui, da cidade de Linhares, que veio à Casa legislativa, à Casa do povo brasileiro, pedir emendas para a cidade, principalmente para o Hospital Rio Doce, que atende o SUS e as demandas daquela região.",GILSON_DANIEL,PODE,ES
3602082,"Na cidade de Linhares, uma importante cidade capixaba, nós temos o nosso Deputado Estadual Lucas Scaramussa, que, se Deus permitir, será o próximo Prefeito da cidade, que, junto com o mandato do Guigui, tem feito um grande trabalho na cidade.",GILSON_DANIEL,PODE,ES
3602082,"Eu queria fazer esse registro importante para a cidade de Linhares, pela qual nós temos um carinho muito grande. O Vereador Egmar veio à Casa Legislativa pedir emendas e melhorias para a sua cidade.",GILSON_DANIEL,PODE,ES
3602082,"Muito obrigado, sr. Presidente.",GILSON_DANIEL,PODE,ES
3602092,"- Muito obrigado, Deputado Gilson Daniel.",POMPEO_DE_MATTOS,PDT,RS
3602092,"Seja bem-vindo o convidado de V.Exa., que, aliás, está muito bem representado pelo trabalho que V.Exa. faz aqui no Parlamento nacional.",POMPEO_DE_MATTOS,PDT,RS
3602092,O Deputado Gilson Daniel é uma referência para todos nós.,POMPEO_DE_MATTOS,PDT,RS
3602092,Muito obrigado.,POMPEO_DE_MATTOS,PDT,RS
3602092,"No microfone de aparte, tem a palavra o nosso honrado Líder, nosso pastor, Deputado Eli Borges.",POMPEO_DE_MATTOS,PDT,RS
3602083,"- Presidente, muito obrigado.",ELI_BORGES,PL,TO
3602083,"Eu quero fazer referência a um irmão, o nosso querido Márcio Corrêa, que assumiu um mandato neste Parlamento por alguns dias e que agora é pré-candidato a Prefeito de Anápolis.",ELI_BORGES,PL,TO
3602083,"Eu quero testemunhar para o público de Anápolis, em primeiro lugar, a disposição dele, no tempo em que ficou aqui, de fazer um excelente trabalho. Ele mostrou muita competência no que fez. Em segundo lugar, o compromisso dele com as bandeiras, com as boas bandeiras da brasilidade.",ELI_BORGES,PL,TO
3602083,"Portanto, aos meus irmãos de Anápolis, que são muitos, eu gostaria de pedir que observem bem o currículo do Márcio Corrêa. Eu não tenho dúvida de que, depois das convenções, se for candidato, ele é a melhor opção que nós temos para Prefeito de Anápolis. Ele é do PL. É uma figura importante, é decidido, tem competência, sabe o que faz.",ELI_BORGES,PL,TO
3602083,"Então, aqui, eu vim externar o meu apoio ao meu irmão e amigo Márcio Corrêa.",ELI_BORGES,PL,TO
3602083,Que Deus nos abençoe!,ELI_BORGES,PL,TO
3602083,Obrigado.,ELI_BORGES,PL,TO
3602096,"- Muito obrigado, pastor Deputado Eli Borges.",POMPEO_DE_MATTOS,PDT,RS
3602096,O Deputado Márcio Corrêa desempenhou um grande mandato aqui.,POMPEO_DE_MATTOS,PDT,RS
3602096,"Parabéns a V.Exa.! Competência não lhe falta. Capacidade V.Exa. tem de sobra. E eu tenho certeza que tem muita disposição. Que Deus o proteja sempre! Bom trabalho, Deputado Márcio Corrêa.",POMPEO_DE_MATTOS,PDT,RS
3602096,A próxima inscrição é o Deputado Gabriel Nunes.,POMPEO_DE_MATTOS,PDT,RS
3602096,A próxima inscrição é o Deputado Dr. Frederico. S.Exa. tem a palavra.,POMPEO_DE_MATTOS,PDT,RS
3602084,"- Muito obrigado, Sr. Presidente, Deputado Pompeo de Mattos.",POMPEO_DE_MATTOS,PDT,RS
3602084,"Neste momento, Sr. Presidente, eu quero aproveitar este espaço, que V.Exa. me concedeu, para lamentar profundamente um decreto do Conselho Nacional de Justiça que determina o fechamento dos hospitais de custódia, dos manicômios judiciais. Esse fechamento está acontecendo.",DR_FREDERICO,PRD,MG
3602070,"Apesar de nossa luta aqui nesse tempo todo, a Casa, na minha opinião, não cumpriu o papel. E essas centenas de pessoas com transtornos mentais gravíssimos, praticamente intratáveis, que oferecem um grande risco à sociedade e que nem a família quer recebê-las novamente, começaram a ser soltas agora, a partir de ontem.",DR_FREDERICO,PRD,MG
3602070,"Isso é lamentável, mas esta Casa ainda tem tempo de agir e defender os hospitais de custódia, o manicômio judicial, porque lembro que todos nós somos a favor de cuidar desses pacientes com problemas mentais em âmbito ambulatorial. Ninguém é a favor de manicômios para cuidar de pessoas com problemas mentais, com exceção de pessoas que estão lá, que eu conheci e visitei, que oferecem grande risco à sociedade, pessoas que são intratáveis e pessoas cuja família não consegue mais recebê-las, inclusive, a maior parte dessas pessoas internadas nesses hospitais judiciais fizeram maldade ou crimes contra pessoas da própria família ou mataram.",DR_FREDERICO,PRD,MG
3602070,"Então, isso é muito grave, Presidente Pompeo.",DR_FREDERICO,PRD,MG
3602070,Agradeço a V.Exa. por me conceder esse tempo. Vamos continuar lutando para que essa medida seja revogada e voltemos a proteger os hospitais judiciais.,DR_FREDERICO,PRD,MG
3602070,Muito obrigado.,DR_FREDERICO,PRD,MG
3602071,"- Muito obrigado, eminente Deputado Dr. Frederico. Agradeço a manifestação de V.Exa. com o equilíbrio, a coerência de sempre e a responsabilidade que V.Exa. tem.",POMPEO_DE_MATTOS,PDT,RS
3602071,"Para uma manifestação na tribuna, concedo a palavra ao Deputado Darci de Matos.",POMPEO_DE_MATTOS,PDT,RS
3602071,"Pode ser no microfone de aparte ou na tribuna, V.Exa. que escolhe.",POMPEO_DE_MATTOS,PDT,RS
3602072,"- Sr. Presidente, eu quero saudar com grande alegria aqui na Câmara dos Deputados a presença do Vereador da minha cidade, o Pastor Ascendino, que está aqui nos visitando, buscando recurso.",DARCI_DE_MATOS,PSD,SC
3602072,"Quero saudar o Mazinho, Vereador de Palhoça, que faz um trabalho com as crianças de inclusão social.",DARCI_DE_MATOS,PSD,SC
3602072,"E eu quero saudar, Presidente, o Vereador que mais tem mandato no Brasil. O Pitanta, de Palhoça, tem 12 mandatos — 12 mandatos é porque o cara é bom, trabalhador, maior pescador de garoupa de Santa Catarina.",DARCI_DE_MATOS,PSD,SC
3602072,"Obrigado, Pitanta.",DARCI_DE_MATOS,PSD,SC
3602072,"E quero saudar também a presença do Silveirinha, que é o Presidente do Conselho Nacional dos Despachantes e Documentalistas do Brasil.",DARCI_DE_MATOS,PSD,SC
3602072,Sejam bem-vindos.,DARCI_DE_MATOS,PSD,SC
3602072,"Obrigado, Presidente.",DARCI_DE_MATOS,PSD,SC
3602072,Abraço.,DARCI_DE_MATOS,PSD,SC
3602099,"- Muito obrigado, Deputado Darci de Matos.",POMPEO_DE_MATTOS,PDT,RS
3602099,"Parabéns aos convidados de V.Exa.! Um Vereador com 12 mandatos não é só bom, tem que ser muito bom para ter 12 mandatos de Vereador.",POMPEO_DE_MATTOS,PDT,RS
3602099,A próxima inscrição é do Deputado Gabriel Nunes.,POMPEO_DE_MATTOS,PDT,RS
3602099,Tem a palavra o Deputado Junio Amaral.,POMPEO_DE_MATTOS,PDT,RS
3602099,"Deputado Bibo Nunes, tem a palavra V.Exa. pelo tempo regimental.",POMPEO_DE_MATTOS,PDT,RS
3602073,"- Grato, digníssimo Presidente Pompeo de Mattos, brilhante Presidente, representando o Rio Grande do Sul nesta Casa, na Presidência. É uma honra para todos nós gaúchos.",POMPEO_DE_MATTOS,PDT,RS
3602073,"Eu vou fazer aqui um discurso que é bastante polêmico, porque hoje deveremos ter aqui uma votação muito importante: se mantemos a prisão ou não do Deputado Chiquinho Brazão.",BIBO_NUNES,PL,RS
3602073,"Atenção, Brasil! É muito fácil, é prático votar da maneira mais simples e mais fácil, mas votar com a consciência e com a justiça, respeitando a Constituição Federal.",BIBO_NUNES,PL,RS
3602076,"Se eu, como Parlamentar, vier aqui e não respeitar a Constituição, como muito magistrado faz, eu vou embora. Não me considero Parlamentar. Tenho de respeitar a lei e a Constituição, acima de tudo e, principalmente o art. 53, porque há muito magistrado, que interpreta a imunidade parlamentar que temos. Antes, o art. 53 dizia o seguinte: o Parlamentar é imune pelas palavras que falar. Hoje, o Parlamentar é imune por quaisquer palavras que falar. E mesmo assim, alguns interpretam.",BIBO_NUNES,PL,RS
3602076,"Digo isso porque houve a prisão do Chiquinho Brazão, que, tudo indica, mandou matar Marielle. Não questiono o mérito, mas ninguém pode prender um Deputado se não for dentro da lei. E me admiro do Parlamentar que aceitar um Colega ser preso, não estando dentro da lei. Não olho o mérito da questão. Se matou, se é vampiro, se é lobisomem, não é o caso. Um Parlamentar não pode, em hipótese alguma, ser preso se não for em flagrante e por crime inafiançável. E aconteceu isto.",BIBO_NUNES,PL,RS
3602076,"É claro que não estou defendendo Parlamentar nenhum. Estou defendendo a Constituição Federal, o art. 53, mas, imediatamente pediremos a cassação deste Parlamentar e o envio de seu nome para a Comissão de Ética, porque quem pode punir um Parlamentar é a Câmara Federal, um Deputado Federal é a Câmara Federal. A não ser, na Constituição, se for em flagrante e crime inafiançável.",BIBO_NUNES,PL,RS
3602076,"Tem que ter muita coragem, tem que saber respeitar a Constituição, tem que saber respeitar a lei e tem que, acima de tudo, fazer com que respeitem um Parlamentar eleito pelo povo, com mandato popular. Ninguém, de nenhum Poder, tem o direito de mandar prender. Porque nós, infelizmente, nós da Câmara Federal, nos desmoralizamos quando votamos a favor da prisão do Daniel Silveira. Eu falo ""votamos"", falando como Câmara Federal, porque eu votei contra. Votei contra e alertei, e não vou cometer esse erro. E peço a você, brasileiro, que entenda. Está em jogo, como nunca, a nossa imunidade parlamentar, porque tentam a todo momento cercear a nossa liberdade de expressão.",BIBO_NUNES,PL,RS
3602076,"Nem um cidadão do exterior pode ter sua liberdade de expressão! Querem mandar já no mundo. Pensam que são deuses? Não! Tenho certeza que são deuses, mas, não! Para um democrata, para quem respeita a lei, para quem quer cumprir as determinações, para quem, sendo Parlamentar, entra em um banco e há fila, passa na frente? Não, vai na fila quem quer honra, dignidade e respeito à Constituição!",BIBO_NUNES,PL,RS
3602076,"Hoje, tendo votação, eu votarei pela lei, pela Constituição, pela soltura, mas imediatamente pedindo a cassação deste Deputado, o Chiquinho Brazão, e também para ir ao Conselho de Ética diretamente, porque aqui ele será cassado e punido pela Casa. A Casa é quem pode punir Deputado!",BIBO_NUNES,PL,RS
3602086,"É assim que funciona, em respeito ao art. 53.",BIBO_NUNES,PL,RS
3602098,"- Muito obrigado, Deputado Bibo Nunes.",POMPEO_DE_MATTOS,PDT,RS
3602098,"No microfone de apartes está o Deputado Marcelo Álvaro Antônio, de Minas Gerais. Tem a palavra V.Exa.",POMPEO_DE_MATTOS,PDT,RS
3602087,"- Presidente, obrigado pela oportunidade de falar aqui por 1 ou 2 minutos.",MARCELO_ÁLVARO_ANTÔNIO,PL,MG
3602087,"É uma alegria muito grande ter aqui conosco hoje a dona Tetê. Dona Tetê está aqui hoje, fazendo seus 90 anos de idade, uma assessora exemplar na Câmara dos Deputados. São 37 anos, Presidente, servindo esta Casa. Então, em nome da Tetê, eu quero cumprimentar todos os servidores da Câmara Federal e dizer que é uma grande honra poder contar com a Dona Tetê, que faz esse grande papel, Presidente Bibo, de nos assessorar aqui na Câmara dos Deputados.",MARCELO_ÁLVARO_ANTÔNIO,PL,MG
3602087,"Tetê, que esses noventa anos de vida possam continuar servindo como exemplo para todos nós, o exemplo de uma servidora correta, uma pessoa que, sem dúvida nenhuma, influencia todos nós a fazer, cada dia mais, aquilo que é certo.",MARCELO_ÁLVARO_ANTÔNIO,PL,MG
3602087,"Parabéns, Dona Tetê, que Deus continue abençoando a senhora.",MARCELO_ÁLVARO_ANTÔNIO,PL,MG
3602087,"Agradeço mais uma vez à Dona Tetê. Que a senhora continue com todo esse vigor, com toda essa disposição, dando exemplo para todos nós.",MARCELO_ÁLVARO_ANTÔNIO,PL,MG
3602087,"Parabéns, que Deus te abençoe. Viva a Tetê, viva o Brasil!",MARCELO_ÁLVARO_ANTÔNIO,PL,MG
3602087,Obrigado.,MARCELO_ÁLVARO_ANTÔNIO,PL,MG
3602107,"- Parabéns, Deputado Marcelo Álvaro Antônio.",MARCELO_ÁLVARO_ANTÔNIO,PL,MG
3602107,"Chamo agora para fazer uso da palavra o Deputado gaúcho Pompeo de Mattos, do PDT do Rio Grande do Sul.",POMPEO_DE_MATTOS,PDT,RS
3602107,"Depois, falará o Deputado Osmar Terra por 1 minuto.",POMPEO_DE_MATTOS,PDT,RS
3602089,"- Deputado Bibo Nunes, nós queremos fazer uma manifestação aqui em favor dos autistas. Nós estamos vivendo o chamado Abril Azul, que é o mês dedicado à conscientização, inclusão das pessoas com Transtorno do Espectro Autista, chamado TEA, um distúrbio neurológico que afeta inúmeras famílias, inúmeras pessoas em nosso País e no mundo inteiro, e é preciso acolhimento.",POMPEO_DE_MATTOS,PDT,RS
3602089,"Esta é uma oportunidade para buscarmos a conscientização da sociedade com menos preconceito, com mais inclusão. Isso é essencial, é fundamental. Como representantes eleitos, temos a responsabilidade e o privilégio, ao mesmo tempo, de liderar esse processo aqui na Câmara e no País, dando exemplo, apoiando ações, fortalecendo a inclusão e a conscientização sobre o autismo. Nós queremos um mundo mais respeitoso, mais inclusivo, com mais igualdade, e vamos juntos ampliar esse espaço de acolhimento aos autistas.",POMPEO_DE_MATTOS,PDT,RS
3602174,"Como representante eleito, temos a responsabilidade e o privilégio, ao mesmo tempo, de liderar esse processo aqui na Câmara e no País, dando exemplo, apoiando ações, fortalecendo a inclusão e a conscientização sobre o autismo. Nós queremos um mundo mais respeitoso, mais inclusivo, com mais igualdade e vamos juntos ampliar esse espaço de acolhimento aos autistas.",POMPEO_DE_MATTOS,PDT,RS
3602174,"E quero, Presidente, deixar aqui registrado um poema que fiz em homenagem aos autistas. O poema diz assim:",POMPEO_DE_MATTOS,PDT,RS
3602174,"Por isso, a minha homenagem, o meu carinho a todos os autistas e às famílias dos autistas que precisam de respeito, de amor, de carinho e dedicação. Nesse sentido, tenho a felicidade de conviver com muita gente que luta, Deputada Laura Carneiro, conosco aqui no Parlamento Federal, fazendo a diferença para que os autistas sejam incluídos, respeitados, acolhidos e tenham legislações que lhes deem condições de ocupar o seu espaço, de desempenhar a sua missão. E fico muito feliz por isso.",POMPEO_DE_MATTOS,PDT,RS
3602262,"- Sr. Presidente,...",LAURA_CARNEIRO,PSD,RJ
3602257,"- Obrigado, nobre Deputado Pompeo de Mattos.",POMPEO_DE_MATTOS,PDT,RS
3602257,"Concedo agora a palavra, por 1 minuto, à Deputada Laura Carneiro. Por gentileza, nobre Deputada.",POMPEO_DE_MATTOS,PDT,RS
3602175,"- Obrigada, Presidente. Eu pedi ao Deputado Pompeu que não saísse da tribuna porque é como se eu fosse fazer a S.Exa. um aparte.",LAURA_CARNEIRO,PSD,RJ
3602176,"Quero dizer a V. Exa. que hoje nós acabamos de aprovar, na Comissão de Previdência, um projeto de autoria de V.Exa. e de vários outros Deputados, mas puxado pelo projeto de V.Exa., que trata dos pais e mães atípicos. Esse é um projeto que V.Exa. recomendou muito, e isso é a garantia de que mães e pais terão também atendimento, sendo mães e pais de pessoas com deficiência, especialmente com autismo.",LAURA_CARNEIRO,PSD,RJ
3602176,"Portanto, parabéns a V.Exa. pelo seu trabalho nesta Casa, em favor de crianças e adultos, em favor das pessoas com deficiência e com autismo.",LAURA_CARNEIRO,PSD,RJ
3602177,"- Muito obrigado, Deputada Laura Carneiro, pelo carinho de V.Exa, e muito obrigado pela aprovação do projeto. Eu fico muito feliz. É mais um projeto que aprovamos na Casa? Não. É um projeto especial, porque trata do acolhimento, da proteção do autista, do pai, da mãe, da família, porque ninguém é autista sozinho. Acabamos sendo autistas junto, porque todos vivem aquela realidade, vivem aquela dificuldade e vivem também aquele desafio. É necessário aquele sentimento de respeito, de acolhimento, e é preciso ser compreendido dentro da família e ser compreendido fora da família.",POMPEO_DE_MATTOS,PDT,RS
3602177,"Então, fico muito feliz por um projeto de minha autoria ser aprovado.",POMPEO_DE_MATTOS,PDT,RS
3602177,"Obrigado, Deputada Laura Carneiro, por suas palavras, pelo seu carinho, por tudo que V.Exa. representa na Casa. Nós estamos juntos para muitos debates em defesa dos autistas no nosso País, no meu Rio Grande amado, por esse Brasil afora.",POMPEO_DE_MATTOS,PDT,RS
3602177,"Um grande abraço, muito obrigado.",POMPEO_DE_MATTOS,PDT,RS
3602274,"- Grato, digníssimo Deputado Pompeo de Mattos.",POMPEO_DE_MATTOS,PDT,RS
3602274,"Chamo agora para usar a palavra o Deputado Roberto Monteiro Pai, do PL do Rio de Janeiro.",POMPEO_DE_MATTOS,PDT,RS
3602274,"Por gentileza, Deputado.",POMPEO_DE_MATTOS,PDT,RS
3602178,"- Obrigado, meu nobre Presidente querido, pessoa essa por quem tenho um apreço muito grande. Sempre que fico em Porto Alegre, na Rua da Praia, ou lagarteando no Guaíba, meu Deus, o coração fica extremamente sensível.",ROBERTO_MONTEIRO_PAI,PL,RJ
3602178,"O que me traz aqui neste momento é dizer que Deus existe, e só Ele conhece, de fato, de verdade, os minutos à frente. Então, só Deus é que sabe a verdade do que está sendo projetado.",ROBERTO_MONTEIRO_PAI,PL,RJ
3602178,"Que Deus possa nos dar sabedoria, possa nos dar graça, e que a misericórdia do Eterno possa estar sempre sobre esta Nação.",ROBERTO_MONTEIRO_PAI,PL,RJ
3602178,"Quero aqui aproveitar esta oportunidade. Eu nunca vim ao plenário para atacar alguém, nunca. Seja lá para que time a pessoa torça, eu nunca ataquei ninguém. Mas eu vou fazer uma pergunta: E agora que localizaram os móveis da residência presidencial? Não falaram mais nada? Como esses móveis chegaram, do nada? Passaram um tempo dizendo que eles haviam sido subtraídos da casa presidencial.",ROBERTO_MONTEIRO_PAI,PL,RJ
3602178,"Isso não diferente também do resultado agora da questão das joias. Pelo que chegou ao nosso conhecimento, a Receita Federal reconhece o direito da família Bolsonaro, do casal Bolsonaro, de fazer daquelas joias. Ao mesmo tempo, falo também a respeito daquele peixe que foi importunado, não é isso mesmo?",ROBERTO_MONTEIRO_PAI,PL,RJ
3602178,"Então, como falar agora sobre o que foi dito antes e que agora foi esclarecido? Aí todo mundo se cala, ninguém fala nada.",ROBERTO_MONTEIRO_PAI,PL,RJ
3602178,"Posso finalizar dizendo o seguinte: aonde Bolsonaro vai, a multidão se faz presente.",ROBERTO_MONTEIRO_PAI,PL,RJ
3602104,"No próximo dia 21 agora, na praia de Copacabana, — já faço o convite de forma oficial a todos vocês —, estejam lá para conhecer a praia lindíssima, famosa mundo afora, a praia de Copacabana. Certamente, haverá mais de 2 milhões de pessoas. Eu acredito que vai superar em muito aquele movimento lá na Avenida Paulista, em São Paulo. Aonde Bolsonaro vai, a multidão marca a presença, seja em lugar que for. Podemos saber que Deus, em contagem regressiva, vai chacoalhar a nossa Nação. Certamente, vão lembrar do que eu estou falando previamente, antecipadamente, porque esta Nação pertence ao Senhor nosso Deus.",ROBERTO_MONTEIRO_PAI,PL,RJ
3602104,"Nobre Presidente, solicito que seja divulgada a minha fala no programa A Voz do Brasil.",ROBERTO_MONTEIRO_PAI,PL,RJ
3602104,"Uma coisa é certa é, vejam, esse corpinho bonito que eu tenho e que você tem é uma casa alugada. Você não vai estar sempre nesse corpinho bonito. Diante de Deus, todos nós um dia estaremos presentes para prestar conta dos nossos atos. Lá, não terá chororô, lá não vai ter apadrinhamento, lá não haverá outra coisa a não ser prestar conta pelos bons atos, pelos maus hábitos e também por aqueles hábitos escondidos debaixo do tapete.",ROBERTO_MONTEIRO_PAI,PL,RJ
3602104,Que Deus seja louvado! O futuro somente a Deus pertence!,ROBERTO_MONTEIRO_PAI,PL,RJ
3602104,"Obrigado, meu nobre Presidente.",ROBERTO_MONTEIRO_PAI,PL,RJ
3602105,"- Obrigado, digníssimo Deputado Roberto Monteiro, excelente Parlamentar do Rio de Janeiro.",ROBERTO_MONTEIRO_PAI,PL,RJ
3602105,"Chamo agora a Deputada Adriana Ventura, que no ranking dos políticos está como a número um para o uso da palavra.",ROBERTO_MONTEIRO_PAI,PL,RJ
3602106,"- Obrigada, meu querido Bibo Nunes, muito obrigada, Presidente.",ADRIANA_VENTURA,NOVO,SP
3602106,"Caros colegas, hoje eu trago aqui dois temas, mas o primeiro que eu quero falar é da nossa liberdade ameaçada. Eu acho que todo brasileiro tem o direito de saber o que está acontecendo aqui na nossa República, uma vez que a democracia brasileira está em jogo. E por que eu falo que a democracia brasileira está em jogo? Porque nós estamos com a nossa liberdade de expressão ameaçada. Nós estamos sendo censurados. Esse escândalo do Twitter, que aconteceu esta semana. O mundo está em choque com o que está acontecendo no Brasil. Então, todo mundo tem que ficar preocupado, sim, porque o que nós estamos vendo é que a nossa instituição das leis, a nossa instituição que deveria respeitar a Constituição, que deveria ser guardiã da Constituição, está rasgando a Constituição.",ADRIANA_VENTURA,NOVO,SP
3602106,"E o pior de tudo é o discurso, em nome da defesa de uma suposta democracia. A minha pergunta aqui é: ""como é que há democracia sem liberdade de se expressar? Como é que há democracia se a pessoa não pode ser livre para fazer críticas?"" Eu sou Deputada Federal, eu sou criticada o dia inteiro. As pessoas entram, criticam, está errado isso, não concordo com aquilo, odiei o que você fez aqui, não gostei do seu voto. A crítica faz com que nós melhoremos. Nós não podemos ter seres intocáveis e não sujeitos a críticas. E a censura está se estendendo a Parlamentares, está se estendendo à imprensa. O que estão fazendo com a imprensa? Estão calando a imprensa, perseguindo a imprensa.",ADRIANA_VENTURA,NOVO,SP
3602093,"Nós precisamos reagir. E uma coisa que eu quero dizer. Nós estamos falando de uma instituição, ou melhor, nós estamos falando de um Ministro de uma instituição que tem um papel essencial na nossa República, o de equilíbrio dos Poderes. Isso não pode ser feito dessa maneira. E esta Casa tem que dar uma resposta. Por que? É pela liberdade da expressão, garantida no artigo 220 da nossa Constituição, que a democracia corrige os seus erros, inclusive esse que está sendo feito aqui. Então, se algum Ministro do Supremo Tribunal comete um erro, é a liberdade de expressão que corrige isso.",ADRIANA_VENTURA,NOVO,SP
3602093,,ADRIANA_VENTURA,NOVO,SP
3602093,"Nós estamos falando que estamos sendo censurados, censurados, e não venham com esse discurso fácil falando de desobediência à ordem judicial. É claro que quem desobedece à ordem judicial tem que ser punido, é claro que quem comete abuso já tem instrumento na lei o suficiente. Agora, o que não dá é para termos um Supremo Tribunal Federal ativista, querendo legislar e não cumprindo o seu papel, que é defender o artigo 220 da Constituição. É isso o que não dá, porque o povo vai ser calado, e nós vamos ter que responder para isso.",ADRIANA_VENTURA,NOVO,SP
3602093,"E eu fico realmente muito incomodada ao ver Parlamentares defenderem censura. Nós não podemos ser censurados. Hoje pode ser o lado de cá, mas amanhã vai ser o lado de lá. A imprensa tem que se incomodar, porque tem muitos jornalistas sendo censurados; hoje podem ser eles, amanhã serão vocês. Essa defesa é de todos nós.",ADRIANA_VENTURA,NOVO,SP
